255,"lacus purus aliquet at feugiat non pretium quis lectus suspendisse potenti in eleifend quam a odio in"
256,"nam dui proin leo odio porttitor id consequat in consequat ut nulla sed accumsan felis ut"
257,"porttitor id consequat in consequat ut nulla sed accumsan felis ut at dolor quis odio"
258,"augue quam sollicitudin vitae consectetuer eget rutrum at lorem integer tincidunt ante vel ipsum praesent blandit lacinia erat vestibulum sed"
259,"enim blandit mi in porttitor pede justo eu massa donec"
260,"sem fusce consequat nulla nisl nunc nisl duis bibendum felis sed interdum venenatis turpis enim"
261,"vivamus vel nulla eget eros elementum pellentesque quisque porta volutpat erat quisque erat eros viverra eget congue"
262,"nulla dapibus dolor vel est donec odio justo sollicitudin ut"
263,"ut tellus nulla ut erat id mauris vulputate elementum nullam varius nulla facilisi cras non velit nec nisi vulputate"
264,"in eleifend quam a odio in hac habitasse platea dictumst maecenas ut massa quis augue luctus tincidunt nulla mollis molestie"
265,"sit amet eros suspendisse accumsan tortor quis turpis sed ante vivamus tortor duis mattis egestas metus aenean"
266,"nec dui luctus rutrum nulla tellus in sagittis dui vel nisl duis ac nibh fusce lacus purus"
267,"id nisl venenatis lacinia aenean sit amet justo morbi ut odio cras mi"
268,"tellus nisi eu orci mauris lacinia sapien quis libero nullam sit amet"
269,"in purus eu magna vulputate luctus cum sociis natoque penatibus et magnis dis parturient montes nascetur"
270,"felis fusce posuere felis sed lacus morbi sem mauris laoreet ut rhoncus aliquet pulvinar sed nisl nunc"
271,"leo pellentesque ultrices mattis odio donec vitae nisi nam ultrices libero non mattis pulvinar nulla pede ullamcorper"
272,"pellentesque quisque porta volutpat erat quisque erat eros viverra eget congue eget semper"
273,"nunc donec quis orci eget orci vehicula condimentum curabitur in libero ut massa volutpat convallis morbi"
274,"cubilia curae donec pharetra magna vestibulum aliquet ultrices erat tortor sollicitudin mi sit amet lobortis sapien"
275,"viverra eget congue eget semper rutrum nulla nunc purus phasellus in felis donec semper sapien a"
276,"non mauris morbi non lectus aliquam sit amet diam in magna bibendum imperdiet nullam orci pede"
277,"nunc rhoncus dui vel sem sed sagittis nam congue risus semper porta volutpat quam pede lobortis"
278,"justo pellentesque viverra pede ac diam cras pellentesque volutpat dui maecenas tristique est et tempus semper est"
279,"maecenas rhoncus aliquam lacus morbi quis tortor id nulla ultrices aliquet maecenas leo odio condimentum id"
280,"erat quisque erat eros viverra eget congue eget semper rutrum nulla nunc purus phasellus in felis"
281,"tempus vivamus in felis eu sapien cursus vestibulum proin eu mi nulla ac enim in tempor turpis nec euismod scelerisque"
282,"quis augue luctus tincidunt nulla mollis molestie lorem quisque ut erat curabitur gravida nisi at nibh in hac habitasse platea"
283,"phasellus id sapien in sapien iaculis congue vivamus metus arcu adipiscing molestie hendrerit at vulputate vitae nisl"
284,"sapien ut nunc vestibulum ante ipsum primis in faucibus orci luctus et ultrices posuere cubilia"
285,"luctus ultricies eu nibh quisque id justo sit amet sapien dignissim vestibulum vestibulum ante ipsum primis"
286,"at velit vivamus vel nulla eget eros elementum pellentesque quisque porta volutpat erat quisque erat"
287,"quam suspendisse potenti nullam porttitor lacus at turpis donec posuere metus vitae ipsum aliquam non mauris morbi"
288,"congue risus semper porta volutpat quam pede lobortis ligula sit amet eleifend pede libero quis orci nullam molestie nibh in"
289,"in magna bibendum imperdiet nullam orci pede venenatis non sodales"
290,"eu nibh quisque id justo sit amet sapien dignissim vestibulum vestibulum ante"
291,"dapibus dolor vel est donec odio justo sollicitudin ut suscipit a"
292,"dapibus augue vel accumsan tellus nisi eu orci mauris lacinia sapien quis libero nullam sit amet turpis elementum"
293,"donec odio justo sollicitudin ut suscipit a feugiat et eros vestibulum ac est lacinia nisi venenatis tristique fusce congue diam"
294,"convallis nulla neque libero convallis eget eleifend luctus ultricies eu nibh quisque id justo sit amet"
295,"nulla sed accumsan felis ut at dolor quis odio consequat varius integer ac leo pellentesque ultrices mattis"
296,"justo lacinia eget tincidunt eget tempus vel pede morbi porttitor lorem id ligula suspendisse ornare"
297,"dapibus nulla suscipit ligula in lacus curabitur at ipsum ac tellus semper interdum mauris ullamcorper purus sit amet nulla quisque"
298,"cras pellentesque volutpat dui maecenas tristique est et tempus semper est quam pharetra magna"
299,"nibh ligula nec sem duis aliquam convallis nunc proin at turpis a pede posuere nonummy integer"
300,"bibendum morbi non quam nec dui luctus rutrum nulla tellus in sagittis dui vel nisl duis"
301,"porttitor lacus at turpis donec posuere metus vitae ipsum aliquam non mauris morbi non lectus aliquam sit amet diam"
302,"in hac habitasse platea dictumst etiam faucibus cursus urna ut tellus nulla"
303,"consequat varius integer ac leo pellentesque ultrices mattis odio donec vitae nisi nam"
304,"amet cursus id turpis integer aliquet massa id lobortis convallis tortor risus"
305,"sit amet turpis elementum ligula vehicula consequat morbi a ipsum integer a"
306,"pharetra magna vestibulum aliquet ultrices erat tortor sollicitudin mi sit amet"
307,"purus phasellus in felis donec semper sapien a libero nam dui proin leo odio porttitor id consequat in"
308,"dictumst etiam faucibus cursus urna ut tellus nulla ut erat id mauris"
309,"justo aliquam quis turpis eget elit sodales scelerisque mauris sit amet eros suspendisse accumsan tortor quis turpis sed"
310,"duis consequat dui nec nisi volutpat eleifend donec ut dolor morbi vel"
311,"sit amet sem fusce consequat nulla nisl nunc nisl duis bibendum felis sed interdum venenatis turpis enim"
312,"eleifend luctus ultricies eu nibh quisque id justo sit amet sapien dignissim vestibulum vestibulum ante ipsum primis"
313,"ut erat curabitur gravida nisi at nibh in hac habitasse platea dictumst aliquam augue quam sollicitudin vitae consectetuer eget"
314,"bibendum morbi non quam nec dui luctus rutrum nulla tellus in sagittis dui vel nisl"
315,"sed tristique in tempus sit amet sem fusce consequat nulla nisl"
316,"proin leo odio porttitor id consequat in consequat ut nulla sed accumsan felis ut at dolor quis odio"
317,"tristique est et tempus semper est quam pharetra magna ac consequat metus sapien ut nunc vestibulum ante"
318,"ante ipsum primis in faucibus orci luctus et ultrices posuere cubilia curae"
319,"in hac habitasse platea dictumst maecenas ut massa quis augue"
320,"nisl ut volutpat sapien arcu sed augue aliquam erat volutpat in congue"
321,"lacus morbi sem mauris laoreet ut rhoncus aliquet pulvinar sed nisl nunc rhoncus dui vel sem sed"
322,"platea dictumst maecenas ut massa quis augue luctus tincidunt nulla mollis molestie lorem quisque ut erat curabitur gravida"
323,"ligula in lacus curabitur at ipsum ac tellus semper interdum mauris ullamcorper purus sit amet nulla quisque arcu libero rutrum"
324,"purus aliquet at feugiat non pretium quis lectus suspendisse potenti in eleifend quam a odio in hac habitasse platea dictumst"
325,"orci eget orci vehicula condimentum curabitur in libero ut massa volutpat convallis"
326,"lacinia aenean sit amet justo morbi ut odio cras mi pede malesuada in imperdiet"
327,"maecenas tincidunt lacus at velit vivamus vel nulla eget eros elementum pellentesque quisque porta volutpat erat quisque erat"
328,"nibh fusce lacus purus aliquet at feugiat non pretium quis"
329,"vulputate justo in blandit ultrices enim lorem ipsum dolor sit amet consectetuer adipiscing elit proin interdum mauris non"
330,"nunc purus phasellus in felis donec semper sapien a libero nam dui proin leo odio"
331,"lacinia erat vestibulum sed magna at nunc commodo placerat praesent blandit nam nulla"
332,"quisque ut erat curabitur gravida nisi at nibh in hac habitasse platea"
333,"accumsan odio curabitur convallis duis consequat dui nec nisi volutpat eleifend donec ut dolor morbi vel lectus in quam fringilla"
334,"eleifend quam a odio in hac habitasse platea dictumst maecenas ut massa quis"
335,"faucibus orci luctus et ultrices posuere cubilia curae donec pharetra magna vestibulum aliquet ultrices erat tortor sollicitudin mi"
336,"ligula pellentesque ultrices phasellus id sapien in sapien iaculis congue vivamus metus arcu"
337,"at velit vivamus vel nulla eget eros elementum pellentesque quisque porta volutpat"
338,"ligula suspendisse ornare consequat lectus in est risus auctor sed tristique in tempus sit amet"
339,"nulla dapibus dolor vel est donec odio justo sollicitudin ut suscipit a feugiat"
340,"turpis donec posuere metus vitae ipsum aliquam non mauris morbi non lectus aliquam sit amet diam in magna bibendum"
341,"suspendisse ornare consequat lectus in est risus auctor sed tristique in tempus sit amet sem fusce consequat nulla nisl nunc"
342,"nullam porttitor lacus at turpis donec posuere metus vitae ipsum aliquam non mauris morbi non lectus aliquam"
343,"imperdiet sapien urna pretium nisl ut volutpat sapien arcu sed augue aliquam"
344,"in sapien iaculis congue vivamus metus arcu adipiscing molestie hendrerit at vulputate vitae nisl aenean lectus"
345,"cum sociis natoque penatibus et magnis dis parturient montes nascetur ridiculus mus vivamus vestibulum sagittis"
346,"aliquam augue quam sollicitudin vitae consectetuer eget rutrum at lorem integer tincidunt ante vel ipsum"
347,"mauris enim leo rhoncus sed vestibulum sit amet cursus id turpis integer aliquet massa id lobortis convallis tortor"
348,"primis in faucibus orci luctus et ultrices posuere cubilia curae mauris viverra diam vitae quam"
349,"nulla tempus vivamus in felis eu sapien cursus vestibulum proin eu mi"
350,"diam in magna bibendum imperdiet nullam orci pede venenatis non sodales sed tincidunt eu felis fusce"
351,"luctus tincidunt nulla mollis molestie lorem quisque ut erat curabitur gravida nisi at nibh in hac habitasse platea"
352,"sed interdum venenatis turpis enim blandit mi in porttitor pede justo"
353,"facilisi cras non velit nec nisi vulputate nonummy maecenas tincidunt lacus at"
354,"eros vestibulum ac est lacinia nisi venenatis tristique fusce congue diam id ornare imperdiet sapien urna pretium nisl ut"
355,"ultricies eu nibh quisque id justo sit amet sapien dignissim vestibulum vestibulum ante ipsum primis in faucibus orci luctus"
356,"justo maecenas rhoncus aliquam lacus morbi quis tortor id nulla ultrices aliquet maecenas leo odio condimentum id"
357,"consequat dui nec nisi volutpat eleifend donec ut dolor morbi"
358,"natoque penatibus et magnis dis parturient montes nascetur ridiculus mus etiam vel augue vestibulum rutrum rutrum neque aenean"
359,"rutrum neque aenean auctor gravida sem praesent id massa id nisl venenatis lacinia aenean"
360,"nibh in hac habitasse platea dictumst aliquam augue quam sollicitudin vitae consectetuer eget rutrum at"
361,"lobortis est phasellus sit amet erat nulla tempus vivamus in felis eu sapien"
362,"nisi venenatis tristique fusce congue diam id ornare imperdiet sapien urna pretium nisl ut volutpat"
363,"felis sed lacus morbi sem mauris laoreet ut rhoncus aliquet pulvinar"
364,"id nisl venenatis lacinia aenean sit amet justo morbi ut"
365,"consectetuer adipiscing elit proin interdum mauris non ligula pellentesque ultrices phasellus id"
366,"nunc commodo placerat praesent blandit nam nulla integer pede justo lacinia eget tincidunt"
367,"in hac habitasse platea dictumst aliquam augue quam sollicitudin vitae consectetuer eget rutrum at"
368,"pretium quis lectus suspendisse potenti in eleifend quam a odio in"
369,"quam pharetra magna ac consequat metus sapien ut nunc vestibulum ante ipsum primis in faucibus"
370,"in hac habitasse platea dictumst aliquam augue quam sollicitudin vitae consectetuer eget rutrum at"
371,"rutrum nulla nunc purus phasellus in felis donec semper sapien a libero nam dui proin leo odio porttitor id"
372,"adipiscing elit proin interdum mauris non ligula pellentesque ultrices phasellus id sapien in sapien iaculis congue vivamus"
373,"vestibulum aliquet ultrices erat tortor sollicitudin mi sit amet lobortis sapien sapien non mi integer ac neque duis"
374,"nibh in lectus pellentesque at nulla suspendisse potenti cras in purus eu magna vulputate luctus cum sociis natoque penatibus"
375,"lectus suspendisse potenti in eleifend quam a odio in hac habitasse platea dictumst"
376,"duis bibendum felis sed interdum venenatis turpis enim blandit mi in porttitor pede justo eu massa donec dapibus duis at"
377,"interdum in ante vestibulum ante ipsum primis in faucibus orci luctus et ultrices posuere cubilia"
378,"nascetur ridiculus mus etiam vel augue vestibulum rutrum rutrum neque aenean auctor gravida sem praesent id massa id"
379,"eu mi nulla ac enim in tempor turpis nec euismod scelerisque quam turpis adipiscing lorem vitae mattis nibh"
380,"augue vestibulum ante ipsum primis in faucibus orci luctus et ultrices posuere"
381,"mauris eget massa tempor convallis nulla neque libero convallis eget"
382,"facilisi cras non velit nec nisi vulputate nonummy maecenas tincidunt"
383,"felis eu sapien cursus vestibulum proin eu mi nulla ac enim in tempor turpis nec euismod scelerisque quam turpis adipiscing"
384,"morbi quis tortor id nulla ultrices aliquet maecenas leo odio condimentum id luctus nec molestie sed justo pellentesque"
385,"augue luctus tincidunt nulla mollis molestie lorem quisque ut erat curabitur gravida nisi at"
386,"enim leo rhoncus sed vestibulum sit amet cursus id turpis"
387,"nonummy maecenas tincidunt lacus at velit vivamus vel nulla eget eros elementum pellentesque quisque porta volutpat erat quisque erat eros"
388,"quis lectus suspendisse potenti in eleifend quam a odio in hac habitasse platea"
389,"metus aenean fermentum donec ut mauris eget massa tempor convallis nulla neque libero convallis eget eleifend luctus"
390,"enim lorem ipsum dolor sit amet consectetuer adipiscing elit proin interdum mauris non ligula pellentesque ultrices phasellus id"
391,"metus arcu adipiscing molestie hendrerit at vulputate vitae nisl aenean lectus pellentesque eget"
392,"sollicitudin mi sit amet lobortis sapien sapien non mi integer ac neque"
393,"imperdiet et commodo vulputate justo in blandit ultrices enim lorem"
394,"morbi non quam nec dui luctus rutrum nulla tellus in sagittis dui vel nisl duis ac nibh fusce lacus purus"
395,"tincidunt in leo maecenas pulvinar lobortis est phasellus sit amet erat nulla tempus vivamus in felis eu sapien cursus"
396,"amet justo morbi ut odio cras mi pede malesuada in imperdiet et commodo vulputate justo in blandit"
397,"sapien iaculis congue vivamus metus arcu adipiscing molestie hendrerit at vulputate vitae nisl aenean lectus pellentesque eget nunc donec quis"
398,"vivamus vel nulla eget eros elementum pellentesque quisque porta volutpat erat"
399,"fusce consequat nulla nisl nunc nisl duis bibendum felis sed interdum venenatis turpis enim blandit mi"
400,"ante ipsum primis in faucibus orci luctus et ultrices posuere cubilia curae duis faucibus accumsan odio"
401,"sapien varius ut blandit non interdum in ante vestibulum ante"
402,"ipsum dolor sit amet consectetuer adipiscing elit proin interdum mauris non ligula pellentesque"
403,"curae mauris viverra diam vitae quam suspendisse potenti nullam porttitor lacus at turpis"
404,"quam pede lobortis ligula sit amet eleifend pede libero quis"
405,"amet cursus id turpis integer aliquet massa id lobortis convallis tortor risus"
406,"amet turpis elementum ligula vehicula consequat morbi a ipsum integer a nibh in quis justo maecenas rhoncus aliquam"
407,"lobortis convallis tortor risus dapibus augue vel accumsan tellus nisi eu orci mauris lacinia sapien quis libero nullam sit amet"
408,"mus etiam vel augue vestibulum rutrum rutrum neque aenean auctor"
409,"leo odio condimentum id luctus nec molestie sed justo pellentesque viverra"
410,"vitae nisl aenean lectus pellentesque eget nunc donec quis orci eget orci vehicula condimentum curabitur in libero ut massa volutpat"
411,"duis mattis egestas metus aenean fermentum donec ut mauris eget massa tempor convallis nulla neque libero"
412,"posuere nonummy integer non velit donec diam neque vestibulum eget vulputate ut"
413,"sapien cursus vestibulum proin eu mi nulla ac enim in tempor turpis"
414,"consequat lectus in est risus auctor sed tristique in tempus sit amet sem fusce consequat nulla nisl"
415,"eu mi nulla ac enim in tempor turpis nec euismod scelerisque quam turpis adipiscing lorem vitae mattis nibh"
416,"maecenas tincidunt lacus at velit vivamus vel nulla eget eros elementum pellentesque quisque porta volutpat erat quisque erat"
417,"ante ipsum primis in faucibus orci luctus et ultrices posuere cubilia curae duis faucibus"
418,"suscipit ligula in lacus curabitur at ipsum ac tellus semper interdum mauris ullamcorper purus sit amet nulla quisque arcu libero"
419,"dolor sit amet consectetuer adipiscing elit proin risus praesent lectus vestibulum quam sapien varius ut blandit non interdum"
420,"luctus et ultrices posuere cubilia curae donec pharetra magna vestibulum aliquet ultrices erat tortor sollicitudin mi sit"
421,"sapien dignissim vestibulum vestibulum ante ipsum primis in faucibus orci luctus et ultrices posuere cubilia curae nulla dapibus"
422,"in leo maecenas pulvinar lobortis est phasellus sit amet erat nulla tempus vivamus in"
423,"non quam nec dui luctus rutrum nulla tellus in sagittis dui"
424,"dictumst aliquam augue quam sollicitudin vitae consectetuer eget rutrum at lorem integer tincidunt ante vel ipsum praesent blandit lacinia"
425,"felis sed interdum venenatis turpis enim blandit mi in porttitor pede justo eu massa donec dapibus duis at velit"
426,"maecenas rhoncus aliquam lacus morbi quis tortor id nulla ultrices aliquet maecenas leo odio condimentum id luctus nec"
427,"cubilia curae mauris viverra diam vitae quam suspendisse potenti nullam porttitor lacus at turpis donec posuere"
428,"nec sem duis aliquam convallis nunc proin at turpis a pede posuere nonummy integer non velit"
429,"dolor morbi vel lectus in quam fringilla rhoncus mauris enim leo rhoncus sed vestibulum"
430,"nullam sit amet turpis elementum ligula vehicula consequat morbi a ipsum"
431,"molestie hendrerit at vulputate vitae nisl aenean lectus pellentesque eget nunc donec quis orci eget"
432,"posuere metus vitae ipsum aliquam non mauris morbi non lectus aliquam sit amet diam in"
433,"mollis molestie lorem quisque ut erat curabitur gravida nisi at nibh in"
434,"justo etiam pretium iaculis justo in hac habitasse platea dictumst etiam faucibus cursus"
435,"luctus nec molestie sed justo pellentesque viverra pede ac diam cras pellentesque volutpat dui maecenas tristique est"
436,"et ultrices posuere cubilia curae nulla dapibus dolor vel est donec odio justo"
437,"vitae quam suspendisse potenti nullam porttitor lacus at turpis donec posuere metus"
438,"dui proin leo odio porttitor id consequat in consequat ut nulla sed accumsan felis"
439,"orci luctus et ultrices posuere cubilia curae donec pharetra magna vestibulum aliquet ultrices erat tortor sollicitudin mi sit amet lobortis"
440,"amet consectetuer adipiscing elit proin interdum mauris non ligula pellentesque ultrices phasellus id sapien in sapien iaculis congue"
441,"sapien iaculis congue vivamus metus arcu adipiscing molestie hendrerit at vulputate vitae"
442,"pellentesque ultrices phasellus id sapien in sapien iaculis congue vivamus metus arcu adipiscing molestie hendrerit at"
443,"nec nisi volutpat eleifend donec ut dolor morbi vel lectus in quam fringilla rhoncus mauris enim leo"
444,"quam fringilla rhoncus mauris enim leo rhoncus sed vestibulum sit amet cursus id turpis integer"
445,"luctus et ultrices posuere cubilia curae duis faucibus accumsan odio"
446,"vitae consectetuer eget rutrum at lorem integer tincidunt ante vel ipsum praesent"
447,"augue vestibulum ante ipsum primis in faucibus orci luctus et ultrices posuere cubilia"
448,"aenean fermentum donec ut mauris eget massa tempor convallis nulla neque libero convallis eget eleifend"
449,"enim sit amet nunc viverra dapibus nulla suscipit ligula in"
450,"accumsan odio curabitur convallis duis consequat dui nec nisi volutpat eleifend donec ut dolor"
451,"purus phasellus in felis donec semper sapien a libero nam dui proin leo odio porttitor id consequat in consequat ut"
452,"suspendisse potenti nullam porttitor lacus at turpis donec posuere metus"
453,"elementum pellentesque quisque porta volutpat erat quisque erat eros viverra eget congue eget semper rutrum nulla nunc purus"
454,"ridiculus mus vivamus vestibulum sagittis sapien cum sociis natoque penatibus et magnis dis"
455,"duis aliquam convallis nunc proin at turpis a pede posuere nonummy integer non velit donec diam neque"
456,"morbi vel lectus in quam fringilla rhoncus mauris enim leo rhoncus sed vestibulum sit amet cursus"
457,"parturient montes nascetur ridiculus mus etiam vel augue vestibulum rutrum rutrum neque aenean auctor gravida sem praesent id massa id"
458,"sit amet erat nulla tempus vivamus in felis eu sapien cursus vestibulum proin eu mi nulla ac"
459,"luctus ultricies eu nibh quisque id justo sit amet sapien dignissim vestibulum"
460,"sapien urna pretium nisl ut volutpat sapien arcu sed augue aliquam erat volutpat"
461,"maecenas tristique est et tempus semper est quam pharetra magna ac consequat metus sapien ut nunc vestibulum ante"
462,"justo morbi ut odio cras mi pede malesuada in imperdiet et commodo vulputate"
463,"sapien a libero nam dui proin leo odio porttitor id consequat in"
464,"tellus nisi eu orci mauris lacinia sapien quis libero nullam sit"
465,"ut massa volutpat convallis morbi odio odio elementum eu interdum eu tincidunt in leo"
466,"praesent blandit lacinia erat vestibulum sed magna at nunc commodo placerat praesent blandit nam nulla integer pede justo lacinia"
467,"nec nisi volutpat eleifend donec ut dolor morbi vel lectus in quam"
468,"non lectus aliquam sit amet diam in magna bibendum imperdiet nullam orci pede venenatis non sodales sed tincidunt eu felis"
469,"sit amet sapien dignissim vestibulum vestibulum ante ipsum primis in faucibus"
470,"leo odio condimentum id luctus nec molestie sed justo pellentesque viverra pede ac diam cras pellentesque volutpat dui maecenas tristique"
471,"dapibus nulla suscipit ligula in lacus curabitur at ipsum ac tellus semper interdum mauris ullamcorper purus sit amet"
472,"ut dolor morbi vel lectus in quam fringilla rhoncus mauris enim leo rhoncus sed vestibulum sit amet"
473,"amet diam in magna bibendum imperdiet nullam orci pede venenatis non sodales sed tincidunt eu felis fusce posuere felis"
474,"morbi vel lectus in quam fringilla rhoncus mauris enim leo rhoncus"
475,"mi pede malesuada in imperdiet et commodo vulputate justo in blandit ultrices enim lorem ipsum dolor sit amet"
476,"integer tincidunt ante vel ipsum praesent blandit lacinia erat vestibulum sed magna"
477,"ligula nec sem duis aliquam convallis nunc proin at turpis"
478,"quisque arcu libero rutrum ac lobortis vel dapibus at diam nam tristique tortor eu pede"
479,"nulla neque libero convallis eget eleifend luctus ultricies eu nibh quisque id justo sit amet"
480,"turpis nec euismod scelerisque quam turpis adipiscing lorem vitae mattis nibh ligula"
481,"nullam porttitor lacus at turpis donec posuere metus vitae ipsum aliquam non mauris morbi non lectus aliquam sit amet"
482,"phasellus id sapien in sapien iaculis congue vivamus metus arcu adipiscing molestie hendrerit"
483,"maecenas tristique est et tempus semper est quam pharetra magna ac consequat metus sapien"
484,"odio elementum eu interdum eu tincidunt in leo maecenas pulvinar lobortis est phasellus sit amet erat nulla tempus vivamus in"
485,"venenatis lacinia aenean sit amet justo morbi ut odio cras mi pede malesuada in"
486,"ridiculus mus etiam vel augue vestibulum rutrum rutrum neque aenean auctor gravida sem praesent id"
487,"nisi eu orci mauris lacinia sapien quis libero nullam sit amet turpis elementum ligula vehicula consequat morbi a"
488,"nulla neque libero convallis eget eleifend luctus ultricies eu nibh quisque id justo sit amet sapien dignissim"
489,"lacus morbi sem mauris laoreet ut rhoncus aliquet pulvinar sed nisl nunc rhoncus dui vel sem"
490,"risus dapibus augue vel accumsan tellus nisi eu orci mauris lacinia"
491,"vitae mattis nibh ligula nec sem duis aliquam convallis nunc proin at turpis a pede posuere nonummy integer non velit"
492,"porta volutpat quam pede lobortis ligula sit amet eleifend pede libero quis"
493,"sociis natoque penatibus et magnis dis parturient montes nascetur ridiculus mus etiam vel augue vestibulum rutrum rutrum neque"
494,"vivamus in felis eu sapien cursus vestibulum proin eu mi nulla ac enim"
495,"sagittis dui vel nisl duis ac nibh fusce lacus purus aliquet at"
496,"mattis nibh ligula nec sem duis aliquam convallis nunc proin"
497,"id lobortis convallis tortor risus dapibus augue vel accumsan tellus nisi"
498,"sit amet turpis elementum ligula vehicula consequat morbi a ipsum"
499,"duis faucibus accumsan odio curabitur convallis duis consequat dui nec nisi volutpat eleifend donec ut dolor"
500,"elementum eu interdum eu tincidunt in leo maecenas pulvinar lobortis est phasellus"
501,"convallis nunc proin at turpis a pede posuere nonummy integer non velit donec diam neque vestibulum eget vulputate ut"
502,"quisque porta volutpat erat quisque erat eros viverra eget congue eget semper rutrum nulla"
503,"amet consectetuer adipiscing elit proin risus praesent lectus vestibulum quam sapien varius ut blandit non interdum in ante vestibulum ante"
504,"ut suscipit a feugiat et eros vestibulum ac est lacinia nisi venenatis"
505,"eu orci mauris lacinia sapien quis libero nullam sit amet turpis elementum"
