756,"nulla dapibus dolor vel est donec odio justo sollicitudin ut suscipit a feugiat et eros vestibulum"
757,"nec dui luctus rutrum nulla tellus in sagittis dui vel nisl duis ac nibh"
758,"at nulla suspendisse potenti cras in purus eu magna vulputate luctus cum sociis natoque penatibus et magnis dis parturient"
759,"praesent id massa id nisl venenatis lacinia aenean sit amet justo morbi ut odio cras"
760,"lacinia aenean sit amet justo morbi ut odio cras mi pede malesuada in imperdiet"
761,"ipsum dolor sit amet consectetuer adipiscing elit proin risus praesent lectus"
762,"fringilla rhoncus mauris enim leo rhoncus sed vestibulum sit amet cursus id turpis integer aliquet massa"
763,"augue quam sollicitudin vitae consectetuer eget rutrum at lorem integer tincidunt"
764,"maecenas pulvinar lobortis est phasellus sit amet erat nulla tempus vivamus in"
765,"curae nulla dapibus dolor vel est donec odio justo sollicitudin ut suscipit a feugiat et eros"
766,"massa tempor convallis nulla neque libero convallis eget eleifend luctus ultricies eu nibh quisque id justo sit amet"
767,"quis justo maecenas rhoncus aliquam lacus morbi quis tortor id nulla ultrices aliquet"
768,"suscipit ligula in lacus curabitur at ipsum ac tellus semper interdum mauris ullamcorper purus sit amet nulla quisque arcu libero"
769,"eleifend donec ut dolor morbi vel lectus in quam fringilla rhoncus mauris enim leo rhoncus sed vestibulum sit amet cursus"
770,"sit amet consectetuer adipiscing elit proin risus praesent lectus vestibulum"
771,"libero ut massa volutpat convallis morbi odio odio elementum eu interdum eu tincidunt"
772,"posuere felis sed lacus morbi sem mauris laoreet ut rhoncus aliquet pulvinar sed nisl nunc rhoncus"
773,"et ultrices posuere cubilia curae duis faucibus accumsan odio curabitur convallis duis consequat dui nec nisi volutpat"
774,"fermentum justo nec condimentum neque sapien placerat ante nulla justo aliquam"
775,"maecenas tristique est et tempus semper est quam pharetra magna ac consequat metus sapien ut nunc vestibulum ante"
776,"nam dui proin leo odio porttitor id consequat in consequat ut nulla sed accumsan felis ut at"
777,"aliquet ultrices erat tortor sollicitudin mi sit amet lobortis sapien sapien non mi integer"
778,"viverra eget congue eget semper rutrum nulla nunc purus phasellus"
779,"vel nulla eget eros elementum pellentesque quisque porta volutpat erat quisque erat eros viverra"
780,"convallis tortor risus dapibus augue vel accumsan tellus nisi eu orci mauris lacinia sapien quis libero nullam sit"
781,"cras mi pede malesuada in imperdiet et commodo vulputate justo in blandit ultrices enim lorem ipsum"
782,"at velit vivamus vel nulla eget eros elementum pellentesque quisque porta volutpat erat quisque erat eros viverra eget congue eget"
783,"leo pellentesque ultrices mattis odio donec vitae nisi nam ultrices"
784,"in hac habitasse platea dictumst etiam faucibus cursus urna ut tellus nulla ut"
785,"nisl duis bibendum felis sed interdum venenatis turpis enim blandit mi in porttitor pede justo eu massa donec dapibus"
786,"hac habitasse platea dictumst aliquam augue quam sollicitudin vitae consectetuer eget rutrum at"
787,"imperdiet nullam orci pede venenatis non sodales sed tincidunt eu"
788,"nisl ut volutpat sapien arcu sed augue aliquam erat volutpat"
789,"ut massa volutpat convallis morbi odio odio elementum eu interdum eu"
790,"duis aliquam convallis nunc proin at turpis a pede posuere nonummy integer non velit"
791,"ipsum dolor sit amet consectetuer adipiscing elit proin risus praesent lectus vestibulum quam sapien varius ut blandit"
792,"pretium quis lectus suspendisse potenti in eleifend quam a odio in hac habitasse"
793,"non mauris morbi non lectus aliquam sit amet diam in magna bibendum imperdiet nullam orci pede venenatis non sodales sed"
794,"non sodales sed tincidunt eu felis fusce posuere felis sed lacus morbi sem mauris laoreet ut rhoncus aliquet pulvinar"
795,"mattis pulvinar nulla pede ullamcorper augue a suscipit nulla elit ac nulla sed vel enim sit amet"
796,"ut massa volutpat convallis morbi odio odio elementum eu interdum eu"
797,"quis justo maecenas rhoncus aliquam lacus morbi quis tortor id nulla ultrices aliquet maecenas leo odio condimentum id luctus nec"
798,"morbi porttitor lorem id ligula suspendisse ornare consequat lectus in est"
799,"diam vitae quam suspendisse potenti nullam porttitor lacus at turpis donec posuere metus vitae ipsum aliquam non"
800,"donec quis orci eget orci vehicula condimentum curabitur in libero ut massa volutpat convallis morbi odio odio elementum eu"
801,"elementum nullam varius nulla facilisi cras non velit nec nisi vulputate nonummy maecenas tincidunt lacus at velit vivamus"
802,"odio odio elementum eu interdum eu tincidunt in leo maecenas pulvinar lobortis est phasellus sit amet erat nulla"
803,"lobortis convallis tortor risus dapibus augue vel accumsan tellus nisi eu orci mauris lacinia sapien"
804,"morbi a ipsum integer a nibh in quis justo maecenas rhoncus aliquam lacus morbi quis tortor id nulla ultrices aliquet"
805,"ac leo pellentesque ultrices mattis odio donec vitae nisi nam ultrices libero non mattis"
806,"mattis odio donec vitae nisi nam ultrices libero non mattis pulvinar nulla pede ullamcorper"
807,"est phasellus sit amet erat nulla tempus vivamus in felis eu sapien cursus vestibulum proin"
808,"venenatis non sodales sed tincidunt eu felis fusce posuere felis sed lacus morbi sem mauris"
809,"adipiscing lorem vitae mattis nibh ligula nec sem duis aliquam convallis nunc proin at turpis a pede posuere nonummy"
810,"convallis morbi odio odio elementum eu interdum eu tincidunt in leo maecenas"
811,"neque aenean auctor gravida sem praesent id massa id nisl venenatis lacinia aenean sit amet justo morbi ut"
812,"eu orci mauris lacinia sapien quis libero nullam sit amet turpis elementum ligula vehicula"
813,"posuere cubilia curae mauris viverra diam vitae quam suspendisse potenti nullam porttitor lacus"
814,"sed vel enim sit amet nunc viverra dapibus nulla suscipit ligula in lacus curabitur at ipsum ac"
815,"pellentesque ultrices mattis odio donec vitae nisi nam ultrices libero non mattis pulvinar nulla pede ullamcorper augue a"
816,"et commodo vulputate justo in blandit ultrices enim lorem ipsum"
817,"tempus vivamus in felis eu sapien cursus vestibulum proin eu mi nulla ac enim in tempor turpis nec euismod scelerisque"
818,"vehicula consequat morbi a ipsum integer a nibh in quis justo maecenas"
819,"ut at dolor quis odio consequat varius integer ac leo pellentesque ultrices mattis odio donec vitae"
820,"dolor vel est donec odio justo sollicitudin ut suscipit a feugiat et eros vestibulum ac"
821,"cubilia curae duis faucibus accumsan odio curabitur convallis duis consequat dui nec nisi volutpat eleifend donec"
822,"eu orci mauris lacinia sapien quis libero nullam sit amet turpis elementum"
823,"ut massa volutpat convallis morbi odio odio elementum eu interdum eu"
824,"vitae ipsum aliquam non mauris morbi non lectus aliquam sit amet diam in magna bibendum imperdiet nullam"
825,"mauris vulputate elementum nullam varius nulla facilisi cras non velit nec"
826,"convallis nulla neque libero convallis eget eleifend luctus ultricies eu nibh quisque id justo sit amet sapien dignissim vestibulum vestibulum"
827,"mi in porttitor pede justo eu massa donec dapibus duis at velit eu est congue elementum in hac habitasse"
828,"consequat ut nulla sed accumsan felis ut at dolor quis odio consequat varius integer ac leo pellentesque ultrices"
829,"etiam vel augue vestibulum rutrum rutrum neque aenean auctor gravida sem praesent id massa id nisl venenatis lacinia"
830,"pellentesque viverra pede ac diam cras pellentesque volutpat dui maecenas"
831,"tincidunt eu felis fusce posuere felis sed lacus morbi sem mauris laoreet ut rhoncus aliquet pulvinar sed"
832,"maecenas leo odio condimentum id luctus nec molestie sed justo pellentesque viverra pede ac diam cras pellentesque volutpat"
833,"ridiculus mus vivamus vestibulum sagittis sapien cum sociis natoque penatibus"
834,"convallis morbi odio odio elementum eu interdum eu tincidunt in leo maecenas pulvinar lobortis est"
835,"vestibulum ante ipsum primis in faucibus orci luctus et ultrices posuere cubilia curae mauris viverra diam vitae quam suspendisse"
836,"adipiscing molestie hendrerit at vulputate vitae nisl aenean lectus pellentesque eget nunc donec quis orci eget orci vehicula condimentum"
837,"nulla ut erat id mauris vulputate elementum nullam varius nulla facilisi"
838,"eleifend pede libero quis orci nullam molestie nibh in lectus pellentesque at nulla suspendisse potenti cras"
839,"vel sem sed sagittis nam congue risus semper porta volutpat quam pede"
840,"erat volutpat in congue etiam justo etiam pretium iaculis justo in hac habitasse platea dictumst etiam faucibus"
841,"aenean auctor gravida sem praesent id massa id nisl venenatis lacinia aenean sit amet justo"
842,"suspendisse potenti nullam porttitor lacus at turpis donec posuere metus"
843,"rhoncus dui vel sem sed sagittis nam congue risus semper porta volutpat quam pede lobortis"
844,"volutpat in congue etiam justo etiam pretium iaculis justo in"
845,"a suscipit nulla elit ac nulla sed vel enim sit"
846,"elementum in hac habitasse platea dictumst morbi vestibulum velit id pretium iaculis diam"
847,"blandit lacinia erat vestibulum sed magna at nunc commodo placerat praesent blandit nam nulla integer pede justo"
848,"sed interdum venenatis turpis enim blandit mi in porttitor pede justo eu massa donec dapibus duis at velit eu"
849,"non pretium quis lectus suspendisse potenti in eleifend quam a odio in hac"
850,"metus sapien ut nunc vestibulum ante ipsum primis in faucibus orci luctus et ultrices posuere"
851,"lacus purus aliquet at feugiat non pretium quis lectus suspendisse potenti in eleifend quam a odio in hac"
852,"ultrices posuere cubilia curae donec pharetra magna vestibulum aliquet ultrices erat tortor"
853,"metus arcu adipiscing molestie hendrerit at vulputate vitae nisl aenean lectus pellentesque eget"
854,"at ipsum ac tellus semper interdum mauris ullamcorper purus sit amet nulla quisque arcu libero rutrum ac"
855,"cubilia curae mauris viverra diam vitae quam suspendisse potenti nullam porttitor lacus at turpis"
856,"curabitur at ipsum ac tellus semper interdum mauris ullamcorper purus"
857,"commodo vulputate justo in blandit ultrices enim lorem ipsum dolor"
858,"eget elit sodales scelerisque mauris sit amet eros suspendisse accumsan"
859,"feugiat non pretium quis lectus suspendisse potenti in eleifend quam a odio in hac habitasse"
860,"cubilia curae nulla dapibus dolor vel est donec odio justo sollicitudin ut suscipit a feugiat et eros"
861,"platea dictumst morbi vestibulum velit id pretium iaculis diam erat fermentum justo"
862,"cras mi pede malesuada in imperdiet et commodo vulputate justo in blandit"
863,"ligula vehicula consequat morbi a ipsum integer a nibh in quis justo maecenas rhoncus aliquam lacus morbi quis tortor id"
864,"urna pretium nisl ut volutpat sapien arcu sed augue aliquam erat volutpat in congue etiam justo etiam pretium"
865,"cras pellentesque volutpat dui maecenas tristique est et tempus semper est quam pharetra magna ac consequat metus sapien"
866,"curabitur gravida nisi at nibh in hac habitasse platea dictumst aliquam augue quam sollicitudin vitae consectetuer eget"
867,"pede justo lacinia eget tincidunt eget tempus vel pede morbi porttitor lorem id ligula suspendisse ornare consequat"
868,"cursus vestibulum proin eu mi nulla ac enim in tempor turpis nec euismod scelerisque"
869,"nullam orci pede venenatis non sodales sed tincidunt eu felis fusce posuere felis sed lacus morbi sem mauris laoreet ut"
870,"augue vestibulum ante ipsum primis in faucibus orci luctus et ultrices posuere"
871,"eget tincidunt eget tempus vel pede morbi porttitor lorem id ligula suspendisse"
872,"amet diam in magna bibendum imperdiet nullam orci pede venenatis non sodales sed tincidunt eu felis fusce posuere"
873,"nibh quisque id justo sit amet sapien dignissim vestibulum vestibulum ante ipsum"
874,"nam ultrices libero non mattis pulvinar nulla pede ullamcorper augue a suscipit nulla elit ac nulla sed vel enim"
875,"ultrices vel augue vestibulum ante ipsum primis in faucibus orci luctus et ultrices posuere cubilia curae"
876,"tellus nisi eu orci mauris lacinia sapien quis libero nullam sit amet"
877,"elit proin risus praesent lectus vestibulum quam sapien varius ut blandit"
878,"vivamus vel nulla eget eros elementum pellentesque quisque porta volutpat erat quisque erat eros viverra eget congue"
879,"est congue elementum in hac habitasse platea dictumst morbi vestibulum"
880,"ipsum dolor sit amet consectetuer adipiscing elit proin risus praesent lectus vestibulum"
881,"volutpat dui maecenas tristique est et tempus semper est quam pharetra magna ac consequat metus sapien ut nunc vestibulum ante"
882,"consequat metus sapien ut nunc vestibulum ante ipsum primis in faucibus"
883,"nam congue risus semper porta volutpat quam pede lobortis ligula sit amet eleifend pede"
884,"non mi integer ac neque duis bibendum morbi non quam nec dui luctus rutrum nulla tellus in sagittis dui vel"
885,"vulputate elementum nullam varius nulla facilisi cras non velit nec nisi vulputate"
886,"primis in faucibus orci luctus et ultrices posuere cubilia curae donec pharetra magna vestibulum aliquet ultrices"
887,"praesent lectus vestibulum quam sapien varius ut blandit non interdum in ante vestibulum ante ipsum"
888,"tempus sit amet sem fusce consequat nulla nisl nunc nisl duis bibendum felis sed interdum venenatis"
889,"nec nisi volutpat eleifend donec ut dolor morbi vel lectus in quam fringilla rhoncus"
890,"interdum mauris ullamcorper purus sit amet nulla quisque arcu libero rutrum ac lobortis"
891,"sed tincidunt eu felis fusce posuere felis sed lacus morbi sem mauris laoreet ut rhoncus aliquet pulvinar sed"
892,"accumsan odio curabitur convallis duis consequat dui nec nisi volutpat eleifend donec ut dolor morbi vel"
893,"nisl duis bibendum felis sed interdum venenatis turpis enim blandit mi in porttitor pede justo eu massa donec dapibus"
894,"a libero nam dui proin leo odio porttitor id consequat in consequat ut nulla sed accumsan felis ut"
895,"aliquet ultrices erat tortor sollicitudin mi sit amet lobortis sapien sapien non mi integer ac"
896,"amet sapien dignissim vestibulum vestibulum ante ipsum primis in faucibus orci luctus et"
897,"quam fringilla rhoncus mauris enim leo rhoncus sed vestibulum sit"
898,"velit vivamus vel nulla eget eros elementum pellentesque quisque porta volutpat erat quisque erat eros viverra eget congue eget semper"
899,"ridiculus mus etiam vel augue vestibulum rutrum rutrum neque aenean auctor gravida sem praesent id massa"
900,"ante vel ipsum praesent blandit lacinia erat vestibulum sed magna at nunc"
901,"felis eu sapien cursus vestibulum proin eu mi nulla ac enim in tempor turpis"
902,"enim blandit mi in porttitor pede justo eu massa donec dapibus duis at velit"
903,"lectus pellentesque at nulla suspendisse potenti cras in purus eu magna vulputate luctus cum sociis natoque penatibus et magnis dis"
904,"proin eu mi nulla ac enim in tempor turpis nec euismod scelerisque quam turpis adipiscing"
905,"sed vestibulum sit amet cursus id turpis integer aliquet massa id lobortis"
906,"lacus purus aliquet at feugiat non pretium quis lectus suspendisse"
907,"porttitor id consequat in consequat ut nulla sed accumsan felis ut at dolor quis odio consequat varius integer"
908,"nulla ut erat id mauris vulputate elementum nullam varius nulla facilisi cras non velit nec nisi vulputate nonummy maecenas tincidunt"
909,"urna ut tellus nulla ut erat id mauris vulputate elementum"
910,"orci luctus et ultrices posuere cubilia curae donec pharetra magna vestibulum aliquet ultrices erat"
911,"dis parturient montes nascetur ridiculus mus etiam vel augue vestibulum"
912,"donec diam neque vestibulum eget vulputate ut ultrices vel augue vestibulum ante ipsum primis in faucibus orci luctus et"
913,"consectetuer eget rutrum at lorem integer tincidunt ante vel ipsum praesent"
914,"pellentesque eget nunc donec quis orci eget orci vehicula condimentum curabitur in"
915,"purus eu magna vulputate luctus cum sociis natoque penatibus et magnis dis parturient montes nascetur ridiculus"
916,"iaculis diam erat fermentum justo nec condimentum neque sapien placerat ante nulla justo aliquam quis turpis eget elit sodales scelerisque"
917,"sapien sapien non mi integer ac neque duis bibendum morbi"
918,"primis in faucibus orci luctus et ultrices posuere cubilia curae duis faucibus accumsan"
919,"dictumst etiam faucibus cursus urna ut tellus nulla ut erat id mauris vulputate elementum nullam varius nulla"
920,"metus sapien ut nunc vestibulum ante ipsum primis in faucibus orci luctus et ultrices posuere cubilia curae mauris viverra"
921,"maecenas pulvinar lobortis est phasellus sit amet erat nulla tempus vivamus in felis eu sapien cursus"
922,"eleifend luctus ultricies eu nibh quisque id justo sit amet sapien dignissim vestibulum vestibulum ante"
923,"mus vivamus vestibulum sagittis sapien cum sociis natoque penatibus et magnis dis parturient montes nascetur ridiculus mus etiam vel augue"
924,"ante ipsum primis in faucibus orci luctus et ultrices posuere cubilia curae duis faucibus accumsan odio curabitur convallis duis consequat"
925,"ullamcorper augue a suscipit nulla elit ac nulla sed vel enim sit amet nunc viverra dapibus nulla suscipit ligula in"
926,"tincidunt eget tempus vel pede morbi porttitor lorem id ligula suspendisse ornare"
927,"purus phasellus in felis donec semper sapien a libero nam dui proin leo odio"
928,"vel enim sit amet nunc viverra dapibus nulla suscipit ligula in lacus curabitur at ipsum"
929,"lacinia erat vestibulum sed magna at nunc commodo placerat praesent blandit nam nulla integer"
930,"eget eleifend luctus ultricies eu nibh quisque id justo sit amet sapien dignissim"
931,"volutpat erat quisque erat eros viverra eget congue eget semper rutrum nulla nunc"
932,"rhoncus aliquam lacus morbi quis tortor id nulla ultrices aliquet maecenas leo"
933,"pretium quis lectus suspendisse potenti in eleifend quam a odio in hac habitasse"
934,"felis ut at dolor quis odio consequat varius integer ac leo pellentesque ultrices mattis odio"
935,"donec diam neque vestibulum eget vulputate ut ultrices vel augue vestibulum ante ipsum primis"
936,"magna vulputate luctus cum sociis natoque penatibus et magnis dis parturient montes nascetur ridiculus mus vivamus vestibulum sagittis"
937,"ornare imperdiet sapien urna pretium nisl ut volutpat sapien arcu sed augue aliquam erat volutpat in congue etiam"
938,"ut dolor morbi vel lectus in quam fringilla rhoncus mauris enim leo rhoncus sed vestibulum sit amet cursus id turpis"
939,"adipiscing elit proin risus praesent lectus vestibulum quam sapien varius ut blandit non"
940,"venenatis turpis enim blandit mi in porttitor pede justo eu massa donec dapibus duis at velit eu"
941,"ac enim in tempor turpis nec euismod scelerisque quam turpis adipiscing lorem vitae mattis nibh ligula nec sem duis"
942,"rhoncus aliquam lacus morbi quis tortor id nulla ultrices aliquet maecenas leo odio"
943,"aliquam sit amet diam in magna bibendum imperdiet nullam orci pede venenatis non sodales sed tincidunt eu felis fusce"
944,"quis orci eget orci vehicula condimentum curabitur in libero ut massa volutpat convallis morbi odio odio elementum"
945,"quam turpis adipiscing lorem vitae mattis nibh ligula nec sem duis aliquam convallis nunc proin"
946,"urna pretium nisl ut volutpat sapien arcu sed augue aliquam"
947,"proin at turpis a pede posuere nonummy integer non velit donec diam"
948,"integer tincidunt ante vel ipsum praesent blandit lacinia erat vestibulum sed magna at"
949,"a nibh in quis justo maecenas rhoncus aliquam lacus morbi quis tortor"
950,"vivamus tortor duis mattis egestas metus aenean fermentum donec ut mauris eget massa tempor convallis nulla"
951,"mauris eget massa tempor convallis nulla neque libero convallis eget eleifend"
952,"mauris non ligula pellentesque ultrices phasellus id sapien in sapien iaculis congue"
953,"ac consequat metus sapien ut nunc vestibulum ante ipsum primis in faucibus orci luctus et ultrices posuere cubilia"
954,"consequat lectus in est risus auctor sed tristique in tempus sit amet sem fusce"
955,"viverra diam vitae quam suspendisse potenti nullam porttitor lacus at turpis donec"
956,"venenatis tristique fusce congue diam id ornare imperdiet sapien urna pretium nisl ut volutpat sapien arcu sed augue aliquam erat"
957,"curabitur convallis duis consequat dui nec nisi volutpat eleifend donec ut dolor morbi vel lectus in"
958,"quis tortor id nulla ultrices aliquet maecenas leo odio condimentum id"
959,"cras mi pede malesuada in imperdiet et commodo vulputate justo in blandit ultrices enim lorem ipsum dolor sit"
960,"ut massa quis augue luctus tincidunt nulla mollis molestie lorem quisque ut erat"
961,"blandit lacinia erat vestibulum sed magna at nunc commodo placerat praesent blandit nam nulla integer pede justo lacinia eget tincidunt"
962,"iaculis diam erat fermentum justo nec condimentum neque sapien placerat ante nulla justo"
963,"sed vel enim sit amet nunc viverra dapibus nulla suscipit ligula in lacus"
964,"metus arcu adipiscing molestie hendrerit at vulputate vitae nisl aenean"
965,"orci luctus et ultrices posuere cubilia curae nulla dapibus dolor vel est donec odio justo sollicitudin"
966,"feugiat non pretium quis lectus suspendisse potenti in eleifend quam a odio in hac habitasse platea dictumst maecenas"
967,"gravida sem praesent id massa id nisl venenatis lacinia aenean sit amet justo morbi ut odio"
968,"lacinia nisi venenatis tristique fusce congue diam id ornare imperdiet sapien urna pretium nisl"
969,"libero non mattis pulvinar nulla pede ullamcorper augue a suscipit nulla elit ac nulla sed vel enim"
970,"integer pede justo lacinia eget tincidunt eget tempus vel pede"
971,"justo maecenas rhoncus aliquam lacus morbi quis tortor id nulla ultrices aliquet maecenas leo odio condimentum"
972,"nec sem duis aliquam convallis nunc proin at turpis a pede posuere nonummy integer non velit donec diam"
973,"purus phasellus in felis donec semper sapien a libero nam dui"
974,"amet eleifend pede libero quis orci nullam molestie nibh in lectus pellentesque at nulla suspendisse potenti cras in"
975,"urna ut tellus nulla ut erat id mauris vulputate elementum nullam varius nulla facilisi cras non velit nec nisi vulputate"
976,"turpis a pede posuere nonummy integer non velit donec diam neque vestibulum eget vulputate ut ultrices vel augue vestibulum"
977,"volutpat convallis morbi odio odio elementum eu interdum eu tincidunt in leo maecenas"
978,"dui maecenas tristique est et tempus semper est quam pharetra magna ac consequat"
979,"nisl nunc nisl duis bibendum felis sed interdum venenatis turpis enim blandit mi in porttitor pede justo eu"
980,"maecenas tincidunt lacus at velit vivamus vel nulla eget eros elementum pellentesque quisque porta volutpat erat quisque erat eros"
981,"proin risus praesent lectus vestibulum quam sapien varius ut blandit non interdum in ante vestibulum ante ipsum primis"
982,"purus aliquet at feugiat non pretium quis lectus suspendisse potenti in eleifend quam a odio"
983,"auctor sed tristique in tempus sit amet sem fusce consequat nulla nisl nunc nisl duis bibendum felis sed interdum venenatis"
984,"pharetra magna vestibulum aliquet ultrices erat tortor sollicitudin mi sit amet lobortis sapien"
985,"diam erat fermentum justo nec condimentum neque sapien placerat ante nulla justo aliquam quis turpis"
986,"non mi integer ac neque duis bibendum morbi non quam nec dui luctus rutrum nulla tellus in"
987,"posuere cubilia curae donec pharetra magna vestibulum aliquet ultrices erat tortor sollicitudin mi sit amet"
988,"mauris lacinia sapien quis libero nullam sit amet turpis elementum ligula vehicula consequat morbi a ipsum integer"
989,"nisl duis bibendum felis sed interdum venenatis turpis enim blandit mi in porttitor pede justo eu massa donec dapibus"
990,"ut erat curabitur gravida nisi at nibh in hac habitasse platea"
991,"vestibulum ante ipsum primis in faucibus orci luctus et ultrices posuere cubilia curae duis faucibus"
992,"non mauris morbi non lectus aliquam sit amet diam in magna bibendum imperdiet nullam orci pede"
993,"imperdiet sapien urna pretium nisl ut volutpat sapien arcu sed"
994,"nam ultrices libero non mattis pulvinar nulla pede ullamcorper augue a suscipit nulla elit ac nulla sed vel enim sit"
995,"in faucibus orci luctus et ultrices posuere cubilia curae duis faucibus accumsan odio curabitur convallis"
996,"diam neque vestibulum eget vulputate ut ultrices vel augue vestibulum ante ipsum primis"
1000,truc
1001,bidule
1002,bidule
1003,bidule
1004,bidule
1005,bidule
1006,bidule
1007,bidule
1008,bidule
1009,bidule
1010,bidule
1011,bidule
1012,bidule
1013,bidule
1014,bidule
1015,bidule
1016,bidule
1017,bidule
1018,bidule
1019,bidule
1020,bidule
1021,bidule
1022,bidule
1023,bidule
1024,bidule
1025,bidule
1026,bidule
1027,bidule
1028,bidule
1029,bidule
1030,bidule
1031,bidule
1032,bidule
1033,bidule
1034,bidule
1035,bidule
