1,"vitae ipsum aliquam non mauris morbi non lectus aliquam sit amet diam"
2,"hendrerit at vulputate vitae nisl aenean lectus pellentesque eget nunc donec quis orci"
3,"aenean lectus pellentesque eget nunc donec quis orci eget orci vehicula condimentum curabitur in libero ut"
4,"mi nulla ac enim in tempor turpis nec euismod scelerisque quam turpis adipiscing lorem vitae mattis"
5,"ipsum primis in faucibus orci luctus et ultrices posuere cubilia curae donec pharetra magna"
6,"ac consequat metus sapien ut nunc vestibulum ante ipsum primis in faucibus orci luctus et ultrices posuere"
7,"tristique fusce congue diam id ornare imperdiet sapien urna pretium nisl ut volutpat"
8,"et ultrices posuere cubilia curae mauris viverra diam vitae quam suspendisse potenti nullam"
9,"in quam fringilla rhoncus mauris enim leo rhoncus sed vestibulum sit amet"
10,"vestibulum sagittis sapien cum sociis natoque penatibus et magnis dis parturient montes nascetur"
11,"a suscipit nulla elit ac nulla sed vel enim sit amet nunc viverra dapibus nulla suscipit ligula in"
12,"vehicula consequat morbi a ipsum integer a nibh in quis justo"
13,"elementum ligula vehicula consequat morbi a ipsum integer a nibh in"
14,"in leo maecenas pulvinar lobortis est phasellus sit amet erat nulla tempus"
15,"felis sed interdum venenatis turpis enim blandit mi in porttitor pede justo eu massa donec dapibus duis"
16,"nisl duis ac nibh fusce lacus purus aliquet at feugiat non pretium quis"
17,"nunc vestibulum ante ipsum primis in faucibus orci luctus et ultrices posuere cubilia curae mauris viverra diam vitae quam suspendisse"
18,"eros elementum pellentesque quisque porta volutpat erat quisque erat eros viverra eget congue"
19,"integer pede justo lacinia eget tincidunt eget tempus vel pede"
20,"pharetra magna ac consequat metus sapien ut nunc vestibulum ante ipsum primis in faucibus orci luctus et ultrices posuere cubilia"
21,"duis mattis egestas metus aenean fermentum donec ut mauris eget massa"
22,"quisque porta volutpat erat quisque erat eros viverra eget congue eget semper rutrum nulla nunc purus phasellus in felis donec"
23,"turpis nec euismod scelerisque quam turpis adipiscing lorem vitae mattis nibh ligula nec sem duis aliquam convallis"
24,"sed vestibulum sit amet cursus id turpis integer aliquet massa id lobortis convallis tortor risus dapibus augue vel accumsan"
25,"duis bibendum felis sed interdum venenatis turpis enim blandit mi in porttitor pede justo"
26,"nec molestie sed justo pellentesque viverra pede ac diam cras"
27,"adipiscing lorem vitae mattis nibh ligula nec sem duis aliquam convallis nunc proin at"
28,"ipsum dolor sit amet consectetuer adipiscing elit proin interdum mauris non"
29,"morbi porttitor lorem id ligula suspendisse ornare consequat lectus in est risus auctor sed tristique in"
30,"nibh fusce lacus purus aliquet at feugiat non pretium quis lectus suspendisse potenti in eleifend quam a odio in"
31,"in magna bibendum imperdiet nullam orci pede venenatis non sodales sed tincidunt eu felis fusce posuere felis sed"
32,"mauris viverra diam vitae quam suspendisse potenti nullam porttitor lacus at turpis donec"
33,"porttitor lacus at turpis donec posuere metus vitae ipsum aliquam non mauris morbi non lectus"
34,"est phasellus sit amet erat nulla tempus vivamus in felis eu sapien cursus vestibulum proin eu mi"
35,"eu felis fusce posuere felis sed lacus morbi sem mauris laoreet ut rhoncus aliquet pulvinar sed nisl"
36,"ultrices posuere cubilia curae duis faucibus accumsan odio curabitur convallis duis consequat dui nec nisi"
37,"eu interdum eu tincidunt in leo maecenas pulvinar lobortis est phasellus sit amet"
38,"pretium iaculis justo in hac habitasse platea dictumst etiam faucibus cursus urna ut tellus nulla ut erat"
39,"pede libero quis orci nullam molestie nibh in lectus pellentesque"
40,"aliquet maecenas leo odio condimentum id luctus nec molestie sed justo pellentesque viverra pede ac diam"
41,"etiam faucibus cursus urna ut tellus nulla ut erat id mauris vulputate elementum"
42,"in blandit ultrices enim lorem ipsum dolor sit amet consectetuer"
43,"mattis egestas metus aenean fermentum donec ut mauris eget massa tempor convallis nulla neque libero convallis eget eleifend"
44,"sed vel enim sit amet nunc viverra dapibus nulla suscipit"
45,"proin risus praesent lectus vestibulum quam sapien varius ut blandit"
46,"ac neque duis bibendum morbi non quam nec dui luctus rutrum"
47,"sit amet cursus id turpis integer aliquet massa id lobortis convallis"
48,"nulla nisl nunc nisl duis bibendum felis sed interdum venenatis turpis enim blandit mi"
49,"primis in faucibus orci luctus et ultrices posuere cubilia curae duis faucibus accumsan odio curabitur convallis duis consequat"
50,"id consequat in consequat ut nulla sed accumsan felis ut at dolor quis odio consequat"
51,"lacus curabitur at ipsum ac tellus semper interdum mauris ullamcorper purus sit amet nulla quisque arcu libero rutrum ac lobortis"
52,"nulla dapibus dolor vel est donec odio justo sollicitudin ut suscipit a feugiat et eros vestibulum ac est"
53,"quis odio consequat varius integer ac leo pellentesque ultrices mattis odio donec vitae nisi nam ultrices libero non"
54,"luctus nec molestie sed justo pellentesque viverra pede ac diam cras pellentesque volutpat dui maecenas tristique"
55,"ornare consequat lectus in est risus auctor sed tristique in tempus"
56,"dictumst maecenas ut massa quis augue luctus tincidunt nulla mollis molestie lorem quisque ut erat curabitur gravida nisi at nibh"
57,"sodales scelerisque mauris sit amet eros suspendisse accumsan tortor quis turpis sed ante vivamus tortor duis mattis egestas metus"
58,"morbi odio odio elementum eu interdum eu tincidunt in leo"
59,"ut volutpat sapien arcu sed augue aliquam erat volutpat in congue etiam justo etiam pretium iaculis justo in"
60,"nulla quisque arcu libero rutrum ac lobortis vel dapibus at diam nam tristique"
61,"at feugiat non pretium quis lectus suspendisse potenti in eleifend quam a odio in hac habitasse platea dictumst"
62,"ultrices aliquet maecenas leo odio condimentum id luctus nec molestie sed justo"
63,"etiam pretium iaculis justo in hac habitasse platea dictumst etiam faucibus cursus urna"
64,"vel enim sit amet nunc viverra dapibus nulla suscipit ligula in lacus"
65,"donec ut dolor morbi vel lectus in quam fringilla rhoncus mauris enim leo rhoncus sed vestibulum"
66,"erat id mauris vulputate elementum nullam varius nulla facilisi cras non velit nec nisi"
67,"aliquet at feugiat non pretium quis lectus suspendisse potenti in eleifend quam a odio in hac habitasse platea dictumst"
68,"enim sit amet nunc viverra dapibus nulla suscipit ligula in lacus curabitur at ipsum ac tellus semper"
69,"enim leo rhoncus sed vestibulum sit amet cursus id turpis integer aliquet massa id lobortis"
70,"interdum venenatis turpis enim blandit mi in porttitor pede justo eu massa donec dapibus duis"
71,"dui nec nisi volutpat eleifend donec ut dolor morbi vel lectus in"
72,"tortor risus dapibus augue vel accumsan tellus nisi eu orci"
73,"quam suspendisse potenti nullam porttitor lacus at turpis donec posuere metus vitae ipsum aliquam non mauris morbi non lectus aliquam"
74,"ipsum primis in faucibus orci luctus et ultrices posuere cubilia curae duis faucibus accumsan odio"
75,"molestie hendrerit at vulputate vitae nisl aenean lectus pellentesque eget nunc donec quis orci"
76,"augue luctus tincidunt nulla mollis molestie lorem quisque ut erat curabitur gravida nisi at nibh"
77,"fermentum donec ut mauris eget massa tempor convallis nulla neque libero convallis eget eleifend luctus ultricies eu nibh quisque"
78,"quis tortor id nulla ultrices aliquet maecenas leo odio condimentum id luctus"
79,"vestibulum ante ipsum primis in faucibus orci luctus et ultrices posuere cubilia curae donec pharetra magna vestibulum aliquet ultrices erat"
80,"vestibulum rutrum rutrum neque aenean auctor gravida sem praesent id massa"
81,"sodales scelerisque mauris sit amet eros suspendisse accumsan tortor quis"
82,"est lacinia nisi venenatis tristique fusce congue diam id ornare imperdiet sapien urna"
83,"consectetuer adipiscing elit proin interdum mauris non ligula pellentesque ultrices phasellus id sapien in sapien iaculis congue vivamus"
84,"porttitor lorem id ligula suspendisse ornare consequat lectus in est risus auctor sed tristique in tempus sit"
85,"in porttitor pede justo eu massa donec dapibus duis at velit eu est congue elementum in hac habitasse platea"
86,"venenatis non sodales sed tincidunt eu felis fusce posuere felis"
87,"mi nulla ac enim in tempor turpis nec euismod scelerisque"
88,"rutrum nulla tellus in sagittis dui vel nisl duis ac nibh fusce lacus purus aliquet at feugiat non pretium"
89,"aliquam lacus morbi quis tortor id nulla ultrices aliquet maecenas leo odio condimentum id"
90,"vivamus metus arcu adipiscing molestie hendrerit at vulputate vitae nisl aenean lectus pellentesque eget nunc donec quis orci eget"
91,"luctus et ultrices posuere cubilia curae duis faucibus accumsan odio curabitur convallis duis consequat dui nec"
92,"ac est lacinia nisi venenatis tristique fusce congue diam id ornare imperdiet sapien urna pretium nisl ut volutpat sapien"
93,"volutpat in congue etiam justo etiam pretium iaculis justo in hac habitasse platea dictumst etiam faucibus cursus urna ut tellus"
94,"eu nibh quisque id justo sit amet sapien dignissim vestibulum vestibulum ante ipsum primis in faucibus orci luctus et ultrices"
95,"non pretium quis lectus suspendisse potenti in eleifend quam a odio in hac habitasse platea dictumst maecenas ut massa"
96,"eget eros elementum pellentesque quisque porta volutpat erat quisque erat eros"
97,"lacinia eget tincidunt eget tempus vel pede morbi porttitor lorem id ligula suspendisse ornare consequat lectus"
98,"justo morbi ut odio cras mi pede malesuada in imperdiet et commodo vulputate justo in blandit ultrices"
99,"feugiat non pretium quis lectus suspendisse potenti in eleifend quam"
100,"magna at nunc commodo placerat praesent blandit nam nulla integer pede justo lacinia eget"
101,"curabitur at ipsum ac tellus semper interdum mauris ullamcorper purus sit amet nulla quisque arcu libero rutrum ac lobortis vel"
102,"felis sed interdum venenatis turpis enim blandit mi in porttitor pede justo eu massa donec dapibus duis at"
103,"primis in faucibus orci luctus et ultrices posuere cubilia curae mauris viverra diam"
104,"sit amet lobortis sapien sapien non mi integer ac neque"
105,"rhoncus mauris enim leo rhoncus sed vestibulum sit amet cursus id turpis integer aliquet massa id"
106,"lobortis ligula sit amet eleifend pede libero quis orci nullam molestie nibh"
107,"proin eu mi nulla ac enim in tempor turpis nec euismod scelerisque quam turpis adipiscing"
108,"in blandit ultrices enim lorem ipsum dolor sit amet consectetuer adipiscing elit proin interdum mauris non ligula pellentesque"
109,"nisl venenatis lacinia aenean sit amet justo morbi ut odio cras mi pede"
110,"at velit vivamus vel nulla eget eros elementum pellentesque quisque porta volutpat erat"
111,"amet lobortis sapien sapien non mi integer ac neque duis bibendum morbi non quam nec"
112,"erat tortor sollicitudin mi sit amet lobortis sapien sapien non mi integer ac neque duis bibendum morbi non quam"
113,"in sagittis dui vel nisl duis ac nibh fusce lacus purus aliquet at feugiat non pretium quis"
114,"ut massa volutpat convallis morbi odio odio elementum eu interdum eu tincidunt in leo maecenas pulvinar"
115,"proin at turpis a pede posuere nonummy integer non velit donec diam neque vestibulum eget"
116,"vestibulum velit id pretium iaculis diam erat fermentum justo nec"
117,"cum sociis natoque penatibus et magnis dis parturient montes nascetur ridiculus mus"
118,"accumsan felis ut at dolor quis odio consequat varius integer ac leo pellentesque ultrices mattis odio donec vitae"
119,"tempus semper est quam pharetra magna ac consequat metus sapien ut nunc vestibulum"
120,"fusce posuere felis sed lacus morbi sem mauris laoreet ut rhoncus aliquet pulvinar sed nisl"
121,"amet cursus id turpis integer aliquet massa id lobortis convallis tortor risus dapibus augue vel"
122,"rhoncus aliquet pulvinar sed nisl nunc rhoncus dui vel sem sed sagittis nam congue risus"
123,"nulla quisque arcu libero rutrum ac lobortis vel dapibus at diam nam"
124,"mauris laoreet ut rhoncus aliquet pulvinar sed nisl nunc rhoncus dui"
125,"accumsan tortor quis turpis sed ante vivamus tortor duis mattis egestas metus aenean fermentum donec"
126,"sit amet cursus id turpis integer aliquet massa id lobortis"
127,"etiam pretium iaculis justo in hac habitasse platea dictumst etiam faucibus cursus urna ut tellus"
128,"rutrum neque aenean auctor gravida sem praesent id massa id nisl venenatis lacinia"
129,"maecenas tincidunt lacus at velit vivamus vel nulla eget eros elementum pellentesque quisque porta volutpat erat quisque erat eros"
130,"sollicitudin mi sit amet lobortis sapien sapien non mi integer ac neque duis bibendum morbi non quam"
131,"fringilla rhoncus mauris enim leo rhoncus sed vestibulum sit amet cursus id turpis integer aliquet massa id lobortis convallis"
132,"nulla suspendisse potenti cras in purus eu magna vulputate luctus cum sociis natoque penatibus et magnis dis parturient montes nascetur"
133,"montes nascetur ridiculus mus etiam vel augue vestibulum rutrum rutrum neque aenean auctor gravida sem praesent id massa id nisl"
134,"nec sem duis aliquam convallis nunc proin at turpis a pede posuere nonummy integer non velit donec diam"
135,"aenean fermentum donec ut mauris eget massa tempor convallis nulla neque libero convallis eget eleifend luctus ultricies eu nibh quisque"
136,"faucibus accumsan odio curabitur convallis duis consequat dui nec nisi"
137,"molestie hendrerit at vulputate vitae nisl aenean lectus pellentesque eget nunc donec quis orci eget orci vehicula"
138,"tellus semper interdum mauris ullamcorper purus sit amet nulla quisque arcu libero rutrum ac"
139,"at nulla suspendisse potenti cras in purus eu magna vulputate luctus cum sociis"
140,"dictumst aliquam augue quam sollicitudin vitae consectetuer eget rutrum at lorem integer tincidunt ante vel ipsum"
141,"nulla elit ac nulla sed vel enim sit amet nunc viverra dapibus nulla suscipit ligula in"
142,"id turpis integer aliquet massa id lobortis convallis tortor risus dapibus augue"
143,"integer tincidunt ante vel ipsum praesent blandit lacinia erat vestibulum sed magna"
144,"etiam faucibus cursus urna ut tellus nulla ut erat id"
145,"elementum nullam varius nulla facilisi cras non velit nec nisi vulputate nonummy maecenas tincidunt lacus at velit vivamus vel nulla"
146,"sapien ut nunc vestibulum ante ipsum primis in faucibus orci luctus et ultrices posuere cubilia curae mauris"
147,"consectetuer adipiscing elit proin risus praesent lectus vestibulum quam sapien varius ut blandit non interdum in ante vestibulum ante"
148,"donec posuere metus vitae ipsum aliquam non mauris morbi non lectus aliquam sit amet diam"
149,"volutpat sapien arcu sed augue aliquam erat volutpat in congue etiam justo etiam pretium iaculis justo"
150,"ut rhoncus aliquet pulvinar sed nisl nunc rhoncus dui vel sem"
151,"ipsum praesent blandit lacinia erat vestibulum sed magna at nunc commodo placerat praesent blandit nam nulla integer pede justo lacinia"
152,"aliquam lacus morbi quis tortor id nulla ultrices aliquet maecenas leo odio condimentum id luctus nec molestie sed"
153,"eu interdum eu tincidunt in leo maecenas pulvinar lobortis est"
154,"in hac habitasse platea dictumst etiam faucibus cursus urna ut tellus nulla"
155,"eu sapien cursus vestibulum proin eu mi nulla ac enim in tempor"
156,"ultrices posuere cubilia curae duis faucibus accumsan odio curabitur convallis duis consequat dui nec nisi volutpat eleifend donec"
157,"convallis duis consequat dui nec nisi volutpat eleifend donec ut dolor morbi vel lectus in quam fringilla rhoncus mauris"
158,"commodo vulputate justo in blandit ultrices enim lorem ipsum dolor sit amet consectetuer adipiscing elit proin interdum"
159,"ultricies eu nibh quisque id justo sit amet sapien dignissim"
160,"magnis dis parturient montes nascetur ridiculus mus vivamus vestibulum sagittis sapien cum sociis natoque penatibus et magnis dis parturient"
161,"facilisi cras non velit nec nisi vulputate nonummy maecenas tincidunt lacus at velit"
162,"hac habitasse platea dictumst etiam faucibus cursus urna ut tellus nulla ut erat id mauris vulputate"
163,"donec pharetra magna vestibulum aliquet ultrices erat tortor sollicitudin mi sit amet lobortis sapien"
164,"non ligula pellentesque ultrices phasellus id sapien in sapien iaculis congue vivamus metus arcu adipiscing molestie hendrerit at"
165,"ut ultrices vel augue vestibulum ante ipsum primis in faucibus orci luctus et ultrices posuere cubilia curae"
166,"lorem integer tincidunt ante vel ipsum praesent blandit lacinia erat vestibulum"
167,"tempor convallis nulla neque libero convallis eget eleifend luctus ultricies eu nibh quisque id justo sit amet sapien dignissim"
168,"lobortis sapien sapien non mi integer ac neque duis bibendum morbi"
169,"turpis enim blandit mi in porttitor pede justo eu massa donec dapibus duis at"
170,"non interdum in ante vestibulum ante ipsum primis in faucibus orci luctus et ultrices posuere cubilia"
171,"hac habitasse platea dictumst morbi vestibulum velit id pretium iaculis diam erat fermentum justo nec condimentum neque sapien placerat ante"
172,"primis in faucibus orci luctus et ultrices posuere cubilia curae duis faucibus accumsan odio curabitur convallis duis consequat"
173,"donec pharetra magna vestibulum aliquet ultrices erat tortor sollicitudin mi sit amet lobortis"
174,"ligula in lacus curabitur at ipsum ac tellus semper interdum mauris ullamcorper purus sit amet nulla quisque"
175,"massa quis augue luctus tincidunt nulla mollis molestie lorem quisque ut erat curabitur gravida nisi at nibh in hac habitasse"
176,"amet lobortis sapien sapien non mi integer ac neque duis bibendum morbi non quam nec"
177,"sociis natoque penatibus et magnis dis parturient montes nascetur ridiculus mus vivamus"
178,"quis turpis sed ante vivamus tortor duis mattis egestas metus aenean fermentum"
179,"mattis pulvinar nulla pede ullamcorper augue a suscipit nulla elit ac nulla sed"
180,"nulla integer pede justo lacinia eget tincidunt eget tempus vel pede morbi porttitor lorem id ligula"
181,"integer pede justo lacinia eget tincidunt eget tempus vel pede"
182,"magnis dis parturient montes nascetur ridiculus mus vivamus vestibulum sagittis sapien cum sociis natoque penatibus"
183,"mattis nibh ligula nec sem duis aliquam convallis nunc proin"
184,"suscipit ligula in lacus curabitur at ipsum ac tellus semper interdum mauris"
185,"ornare consequat lectus in est risus auctor sed tristique in tempus"
186,"elit ac nulla sed vel enim sit amet nunc viverra dapibus nulla suscipit ligula"
187,"donec quis orci eget orci vehicula condimentum curabitur in libero ut massa volutpat convallis morbi odio odio elementum"
188,"sit amet turpis elementum ligula vehicula consequat morbi a ipsum integer a nibh in quis justo maecenas"
189,"sed augue aliquam erat volutpat in congue etiam justo etiam pretium iaculis justo in hac habitasse platea dictumst etiam faucibus"
190,"ante nulla justo aliquam quis turpis eget elit sodales scelerisque mauris sit amet eros"
191,"porta volutpat erat quisque erat eros viverra eget congue eget semper rutrum nulla nunc purus"
192,"nunc donec quis orci eget orci vehicula condimentum curabitur in libero ut massa volutpat convallis morbi odio"
193,"felis sed interdum venenatis turpis enim blandit mi in porttitor"
194,"duis consequat dui nec nisi volutpat eleifend donec ut dolor morbi"
195,"natoque penatibus et magnis dis parturient montes nascetur ridiculus mus vivamus vestibulum sagittis sapien cum sociis natoque penatibus et"
196,"ut nulla sed accumsan felis ut at dolor quis odio consequat varius integer ac leo pellentesque"
197,"aliquam lacus morbi quis tortor id nulla ultrices aliquet maecenas leo odio condimentum id luctus nec"
198,"vestibulum quam sapien varius ut blandit non interdum in ante vestibulum ante"
199,"imperdiet sapien urna pretium nisl ut volutpat sapien arcu sed augue aliquam erat"
200,"proin eu mi nulla ac enim in tempor turpis nec euismod scelerisque quam"
201,"at turpis donec posuere metus vitae ipsum aliquam non mauris morbi non lectus aliquam sit amet diam"
202,"bibendum felis sed interdum venenatis turpis enim blandit mi in porttitor pede justo eu massa donec dapibus"
203,"sed vel enim sit amet nunc viverra dapibus nulla suscipit ligula in lacus curabitur at ipsum ac tellus semper interdum"
204,"ut ultrices vel augue vestibulum ante ipsum primis in faucibus orci luctus et ultrices"
205,"id luctus nec molestie sed justo pellentesque viverra pede ac diam cras pellentesque volutpat dui maecenas tristique est"
206,"augue vestibulum rutrum rutrum neque aenean auctor gravida sem praesent id massa id nisl venenatis lacinia aenean"
207,"donec dapibus duis at velit eu est congue elementum in hac habitasse"
208,"potenti cras in purus eu magna vulputate luctus cum sociis natoque penatibus et magnis dis parturient"
209,"quam fringilla rhoncus mauris enim leo rhoncus sed vestibulum sit amet cursus id turpis integer aliquet massa id"
210,"sit amet turpis elementum ligula vehicula consequat morbi a ipsum integer a nibh in quis justo maecenas"
211,"vitae ipsum aliquam non mauris morbi non lectus aliquam sit amet"
212,"nulla tellus in sagittis dui vel nisl duis ac nibh fusce lacus"
213,"tortor sollicitudin mi sit amet lobortis sapien sapien non mi integer ac neque duis bibendum morbi"
214,"risus semper porta volutpat quam pede lobortis ligula sit amet eleifend pede libero quis orci nullam molestie nibh"
215,"id massa id nisl venenatis lacinia aenean sit amet justo morbi ut odio cras mi pede"
216,"vehicula condimentum curabitur in libero ut massa volutpat convallis morbi odio"
217,"pretium quis lectus suspendisse potenti in eleifend quam a odio in hac habitasse platea dictumst maecenas"
218,"placerat praesent blandit nam nulla integer pede justo lacinia eget tincidunt eget tempus vel pede morbi porttitor lorem id ligula"
219,"odio in hac habitasse platea dictumst maecenas ut massa quis"
220,"ut massa quis augue luctus tincidunt nulla mollis molestie lorem quisque ut erat curabitur gravida nisi at nibh in"
221,"sed lacus morbi sem mauris laoreet ut rhoncus aliquet pulvinar"
222,"vel sem sed sagittis nam congue risus semper porta volutpat quam"
223,"odio condimentum id luctus nec molestie sed justo pellentesque viverra pede ac diam cras pellentesque"
224,"accumsan tortor quis turpis sed ante vivamus tortor duis mattis egestas metus aenean fermentum donec ut mauris"
225,"leo pellentesque ultrices mattis odio donec vitae nisi nam ultrices"
226,"in magna bibendum imperdiet nullam orci pede venenatis non sodales sed tincidunt eu felis fusce"
227,"in purus eu magna vulputate luctus cum sociis natoque penatibus et magnis dis parturient montes nascetur"
228,"libero ut massa volutpat convallis morbi odio odio elementum eu interdum eu tincidunt in leo maecenas pulvinar lobortis"
229,"venenatis lacinia aenean sit amet justo morbi ut odio cras mi pede malesuada in imperdiet"
230,"elementum eu interdum eu tincidunt in leo maecenas pulvinar lobortis est phasellus sit amet erat nulla tempus vivamus in"
231,"nunc commodo placerat praesent blandit nam nulla integer pede justo lacinia eget tincidunt eget tempus vel pede morbi"
232,"lacus at turpis donec posuere metus vitae ipsum aliquam non mauris"
233,"praesent id massa id nisl venenatis lacinia aenean sit amet justo morbi ut odio cras mi pede malesuada in"
234,"sed sagittis nam congue risus semper porta volutpat quam pede lobortis ligula sit amet eleifend pede"
235,"turpis donec posuere metus vitae ipsum aliquam non mauris morbi non lectus aliquam sit amet diam in magna bibendum"
236,"sed vel enim sit amet nunc viverra dapibus nulla suscipit ligula in"
237,"eros suspendisse accumsan tortor quis turpis sed ante vivamus tortor duis mattis egestas metus aenean fermentum donec ut mauris eget"
238,"ultrices aliquet maecenas leo odio condimentum id luctus nec molestie sed justo pellentesque viverra pede ac diam cras"
239,"lorem id ligula suspendisse ornare consequat lectus in est risus auctor sed tristique in tempus sit"
240,"lectus in est risus auctor sed tristique in tempus sit amet sem fusce consequat nulla nisl"
241,"sit amet nunc viverra dapibus nulla suscipit ligula in lacus curabitur at ipsum ac tellus"
242,"bibendum morbi non quam nec dui luctus rutrum nulla tellus in sagittis dui vel nisl duis ac"
243,"convallis morbi odio odio elementum eu interdum eu tincidunt in"
244,"gravida sem praesent id massa id nisl venenatis lacinia aenean sit amet justo morbi ut"
245,"consequat varius integer ac leo pellentesque ultrices mattis odio donec vitae nisi nam ultrices libero non mattis pulvinar nulla pede"
246,"tincidunt in leo maecenas pulvinar lobortis est phasellus sit amet erat nulla tempus vivamus in felis eu sapien cursus vestibulum"
247,"volutpat convallis morbi odio odio elementum eu interdum eu tincidunt in leo maecenas pulvinar lobortis est phasellus sit amet"
248,"lorem ipsum dolor sit amet consectetuer adipiscing elit proin interdum mauris non ligula pellentesque ultrices phasellus id sapien in"
249,"mus vivamus vestibulum sagittis sapien cum sociis natoque penatibus et magnis dis"
250,"vestibulum sed magna at nunc commodo placerat praesent blandit nam nulla integer pede justo lacinia"
251,"consectetuer adipiscing elit proin risus praesent lectus vestibulum quam sapien varius"
252,"quam sapien varius ut blandit non interdum in ante vestibulum ante ipsum"
253,"sed vestibulum sit amet cursus id turpis integer aliquet massa id lobortis"
254,"mus vivamus vestibulum sagittis sapien cum sociis natoque penatibus et magnis dis"
