506,"aliquam erat volutpat in congue etiam justo etiam pretium iaculis justo in hac"
507,"bibendum felis sed interdum venenatis turpis enim blandit mi in porttitor pede justo eu"
508,"ac est lacinia nisi venenatis tristique fusce congue diam id"
509,"consequat nulla nisl nunc nisl duis bibendum felis sed interdum"
510,"vestibulum velit id pretium iaculis diam erat fermentum justo nec condimentum"
511,"vel augue vestibulum rutrum rutrum neque aenean auctor gravida sem"
512,"vestibulum ac est lacinia nisi venenatis tristique fusce congue diam id ornare imperdiet sapien urna pretium nisl ut volutpat"
513,"nunc vestibulum ante ipsum primis in faucibus orci luctus et ultrices posuere cubilia curae mauris viverra diam vitae quam"
514,"a ipsum integer a nibh in quis justo maecenas rhoncus aliquam lacus morbi quis tortor id"
515,"tincidunt ante vel ipsum praesent blandit lacinia erat vestibulum sed magna at nunc commodo placerat praesent blandit nam nulla"
516,"sit amet nunc viverra dapibus nulla suscipit ligula in lacus curabitur at ipsum ac tellus"
517,"eget congue eget semper rutrum nulla nunc purus phasellus in felis donec semper"
518,"ligula vehicula consequat morbi a ipsum integer a nibh in quis justo maecenas rhoncus aliquam lacus morbi quis"
519,"turpis nec euismod scelerisque quam turpis adipiscing lorem vitae mattis nibh ligula nec sem duis aliquam convallis"
520,"justo morbi ut odio cras mi pede malesuada in imperdiet et commodo vulputate justo in blandit ultrices"
521,"consectetuer adipiscing elit proin risus praesent lectus vestibulum quam sapien varius ut blandit non interdum in"
522,"cursus vestibulum proin eu mi nulla ac enim in tempor turpis nec euismod scelerisque"
523,"faucibus orci luctus et ultrices posuere cubilia curae donec pharetra magna vestibulum aliquet ultrices erat tortor sollicitudin mi sit"
524,"adipiscing elit proin risus praesent lectus vestibulum quam sapien varius ut blandit"
525,"eget orci vehicula condimentum curabitur in libero ut massa volutpat convallis morbi odio odio"
526,"non lectus aliquam sit amet diam in magna bibendum imperdiet nullam orci pede venenatis"
527,"arcu libero rutrum ac lobortis vel dapibus at diam nam"
528,"massa quis augue luctus tincidunt nulla mollis molestie lorem quisque ut erat"
529,"ultrices phasellus id sapien in sapien iaculis congue vivamus metus"
530,"massa tempor convallis nulla neque libero convallis eget eleifend luctus ultricies eu nibh quisque"
531,"arcu sed augue aliquam erat volutpat in congue etiam justo etiam pretium iaculis justo in"
532,"et eros vestibulum ac est lacinia nisi venenatis tristique fusce congue diam id"
533,"arcu libero rutrum ac lobortis vel dapibus at diam nam tristique"
534,"libero nullam sit amet turpis elementum ligula vehicula consequat morbi a ipsum integer a nibh in quis justo maecenas"
535,"urna pretium nisl ut volutpat sapien arcu sed augue aliquam erat volutpat in congue"
536,"vitae nisl aenean lectus pellentesque eget nunc donec quis orci eget orci vehicula condimentum"
537,"faucibus orci luctus et ultrices posuere cubilia curae nulla dapibus dolor vel est donec odio"
538,"curae donec pharetra magna vestibulum aliquet ultrices erat tortor sollicitudin mi sit amet lobortis sapien sapien"
539,"leo pellentesque ultrices mattis odio donec vitae nisi nam ultrices libero non mattis pulvinar nulla pede ullamcorper augue a"
540,"nec nisi volutpat eleifend donec ut dolor morbi vel lectus in quam fringilla rhoncus mauris enim leo rhoncus sed vestibulum"
541,"sapien in sapien iaculis congue vivamus metus arcu adipiscing molestie hendrerit at vulputate vitae nisl aenean lectus pellentesque"
542,"sapien cum sociis natoque penatibus et magnis dis parturient montes nascetur"
543,"eget rutrum at lorem integer tincidunt ante vel ipsum praesent blandit lacinia erat vestibulum sed"
544,"volutpat convallis morbi odio odio elementum eu interdum eu tincidunt in leo maecenas pulvinar lobortis est phasellus sit"
545,"eu magna vulputate luctus cum sociis natoque penatibus et magnis dis parturient montes nascetur ridiculus"
546,"elementum nullam varius nulla facilisi cras non velit nec nisi vulputate nonummy maecenas tincidunt lacus at velit vivamus vel"
547,"lacus purus aliquet at feugiat non pretium quis lectus suspendisse potenti in eleifend quam a odio in"
548,"nunc purus phasellus in felis donec semper sapien a libero nam dui proin leo odio porttitor id consequat in consequat"
549,"in magna bibendum imperdiet nullam orci pede venenatis non sodales"
550,"sem praesent id massa id nisl venenatis lacinia aenean sit"
551,"tincidunt eu felis fusce posuere felis sed lacus morbi sem mauris laoreet ut rhoncus aliquet"
552,"neque libero convallis eget eleifend luctus ultricies eu nibh quisque id justo sit amet sapien"
553,"amet consectetuer adipiscing elit proin interdum mauris non ligula pellentesque ultrices phasellus"
554,"mauris viverra diam vitae quam suspendisse potenti nullam porttitor lacus at turpis"
555,"fusce consequat nulla nisl nunc nisl duis bibendum felis sed interdum venenatis turpis"
556,"pretium nisl ut volutpat sapien arcu sed augue aliquam erat volutpat in"
557,"ligula suspendisse ornare consequat lectus in est risus auctor sed tristique in tempus sit amet sem fusce consequat nulla nisl"
558,"curae duis faucibus accumsan odio curabitur convallis duis consequat dui nec nisi"
559,"vestibulum velit id pretium iaculis diam erat fermentum justo nec condimentum neque sapien placerat ante nulla justo aliquam quis"
560,"felis ut at dolor quis odio consequat varius integer ac leo pellentesque ultrices mattis odio donec vitae"
561,"orci luctus et ultrices posuere cubilia curae duis faucibus accumsan odio curabitur convallis duis consequat dui nec nisi"
562,"id ornare imperdiet sapien urna pretium nisl ut volutpat sapien"
563,"amet justo morbi ut odio cras mi pede malesuada in imperdiet"
564,"nulla ut erat id mauris vulputate elementum nullam varius nulla facilisi cras non velit nec"
565,"ultrices posuere cubilia curae donec pharetra magna vestibulum aliquet ultrices erat tortor sollicitudin mi sit amet"
566,"etiam justo etiam pretium iaculis justo in hac habitasse platea dictumst etiam faucibus cursus urna ut"
567,"id ornare imperdiet sapien urna pretium nisl ut volutpat sapien arcu sed augue aliquam erat"
568,"quam fringilla rhoncus mauris enim leo rhoncus sed vestibulum sit amet cursus id turpis integer aliquet"
569,"pede justo lacinia eget tincidunt eget tempus vel pede morbi porttitor lorem id ligula suspendisse ornare consequat lectus"
570,"suscipit ligula in lacus curabitur at ipsum ac tellus semper interdum mauris ullamcorper"
571,"est quam pharetra magna ac consequat metus sapien ut nunc"
572,"rutrum nulla nunc purus phasellus in felis donec semper sapien a libero nam"
573,"quam sollicitudin vitae consectetuer eget rutrum at lorem integer tincidunt ante vel ipsum praesent blandit lacinia"
574,"amet lobortis sapien sapien non mi integer ac neque duis"
575,"nunc commodo placerat praesent blandit nam nulla integer pede justo lacinia eget tincidunt eget tempus vel pede morbi porttitor lorem"
576,"eget rutrum at lorem integer tincidunt ante vel ipsum praesent blandit lacinia erat vestibulum sed magna at nunc commodo"
577,"cursus vestibulum proin eu mi nulla ac enim in tempor turpis nec euismod scelerisque quam"
578,"nunc commodo placerat praesent blandit nam nulla integer pede justo lacinia eget tincidunt eget tempus vel pede morbi porttitor"
579,"consequat metus sapien ut nunc vestibulum ante ipsum primis in faucibus"
580,"in libero ut massa volutpat convallis morbi odio odio elementum eu interdum eu tincidunt in leo maecenas"
581,"nec nisi vulputate nonummy maecenas tincidunt lacus at velit vivamus vel nulla eget eros elementum pellentesque quisque porta"
582,"consequat lectus in est risus auctor sed tristique in tempus sit amet sem fusce consequat"
583,"imperdiet et commodo vulputate justo in blandit ultrices enim lorem ipsum"
584,"tincidunt ante vel ipsum praesent blandit lacinia erat vestibulum sed magna at nunc commodo placerat praesent blandit"
585,"erat tortor sollicitudin mi sit amet lobortis sapien sapien non mi integer"
586,"semper porta volutpat quam pede lobortis ligula sit amet eleifend pede libero quis"
587,"odio consequat varius integer ac leo pellentesque ultrices mattis odio donec vitae nisi nam ultrices libero non"
588,"tellus nulla ut erat id mauris vulputate elementum nullam varius nulla facilisi cras non velit nec nisi vulputate nonummy maecenas"
589,"faucibus orci luctus et ultrices posuere cubilia curae donec pharetra"
590,"interdum eu tincidunt in leo maecenas pulvinar lobortis est phasellus sit amet erat nulla tempus"
591,"morbi vel lectus in quam fringilla rhoncus mauris enim leo rhoncus sed"
592,"phasellus in felis donec semper sapien a libero nam dui proin leo odio porttitor id consequat"
593,"nec molestie sed justo pellentesque viverra pede ac diam cras pellentesque volutpat dui maecenas tristique est et tempus semper est"
594,"nam ultrices libero non mattis pulvinar nulla pede ullamcorper augue a suscipit nulla elit ac nulla"
595,"ac nulla sed vel enim sit amet nunc viverra dapibus nulla suscipit ligula"
596,"a libero nam dui proin leo odio porttitor id consequat"
597,"ut suscipit a feugiat et eros vestibulum ac est lacinia nisi"
598,"quisque porta volutpat erat quisque erat eros viverra eget congue eget semper rutrum nulla nunc purus"
599,"mus vivamus vestibulum sagittis sapien cum sociis natoque penatibus et magnis dis parturient montes nascetur ridiculus mus etiam vel augue"
600,"eu felis fusce posuere felis sed lacus morbi sem mauris"
601,"pellentesque eget nunc donec quis orci eget orci vehicula condimentum curabitur in libero ut massa volutpat convallis"
602,"in quam fringilla rhoncus mauris enim leo rhoncus sed vestibulum sit amet cursus id turpis integer aliquet massa id lobortis"
603,"congue eget semper rutrum nulla nunc purus phasellus in felis donec semper sapien a libero nam dui"
604,"felis ut at dolor quis odio consequat varius integer ac leo pellentesque ultrices mattis odio donec"
605,"sagittis sapien cum sociis natoque penatibus et magnis dis parturient montes nascetur ridiculus mus etiam vel augue vestibulum rutrum rutrum"
606,"nulla pede ullamcorper augue a suscipit nulla elit ac nulla sed vel enim sit amet nunc viverra"
607,"ac tellus semper interdum mauris ullamcorper purus sit amet nulla quisque arcu libero rutrum ac lobortis vel dapibus at"
608,"scelerisque quam turpis adipiscing lorem vitae mattis nibh ligula nec sem duis aliquam convallis nunc proin at turpis a pede"
609,"lectus vestibulum quam sapien varius ut blandit non interdum in ante vestibulum ante"
610,"amet sapien dignissim vestibulum vestibulum ante ipsum primis in faucibus orci"
611,"tincidunt lacus at velit vivamus vel nulla eget eros elementum pellentesque quisque porta volutpat erat quisque erat eros viverra eget"
612,"pede ullamcorper augue a suscipit nulla elit ac nulla sed vel enim sit"
613,"lacus curabitur at ipsum ac tellus semper interdum mauris ullamcorper"
614,"ante ipsum primis in faucibus orci luctus et ultrices posuere cubilia curae mauris viverra diam vitae"
615,"felis fusce posuere felis sed lacus morbi sem mauris laoreet ut rhoncus aliquet pulvinar sed nisl nunc rhoncus"
616,"montes nascetur ridiculus mus etiam vel augue vestibulum rutrum rutrum neque aenean auctor gravida sem praesent id massa id nisl"
617,"at nunc commodo placerat praesent blandit nam nulla integer pede justo lacinia eget tincidunt eget tempus vel pede morbi porttitor"
618,"diam id ornare imperdiet sapien urna pretium nisl ut volutpat sapien arcu sed augue aliquam erat"
619,"nascetur ridiculus mus vivamus vestibulum sagittis sapien cum sociis natoque penatibus et magnis dis parturient montes nascetur ridiculus mus etiam"
620,"sociis natoque penatibus et magnis dis parturient montes nascetur ridiculus mus vivamus vestibulum sagittis sapien cum sociis natoque"
621,"in eleifend quam a odio in hac habitasse platea dictumst maecenas ut massa quis augue luctus tincidunt"
622,"blandit lacinia erat vestibulum sed magna at nunc commodo placerat praesent"
623,"in hac habitasse platea dictumst morbi vestibulum velit id pretium iaculis diam erat fermentum justo nec condimentum neque"
624,"praesent lectus vestibulum quam sapien varius ut blandit non interdum in ante vestibulum ante ipsum primis in faucibus"
625,"mus vivamus vestibulum sagittis sapien cum sociis natoque penatibus et magnis dis parturient montes nascetur ridiculus mus etiam vel"
626,"justo aliquam quis turpis eget elit sodales scelerisque mauris sit amet"
627,"justo in blandit ultrices enim lorem ipsum dolor sit amet consectetuer adipiscing elit proin interdum mauris non ligula"
628,"vel augue vestibulum ante ipsum primis in faucibus orci luctus et ultrices posuere"
629,"mauris sit amet eros suspendisse accumsan tortor quis turpis sed ante vivamus tortor duis mattis egestas"
630,"neque duis bibendum morbi non quam nec dui luctus rutrum nulla tellus in sagittis dui vel"
631,"purus eu magna vulputate luctus cum sociis natoque penatibus et magnis dis parturient montes nascetur ridiculus mus vivamus vestibulum"
632,"ultrices phasellus id sapien in sapien iaculis congue vivamus metus arcu adipiscing molestie hendrerit at vulputate"
633,"urna pretium nisl ut volutpat sapien arcu sed augue aliquam erat volutpat in congue"
634,"leo maecenas pulvinar lobortis est phasellus sit amet erat nulla tempus vivamus in felis eu sapien cursus vestibulum proin"
635,"porttitor lacus at turpis donec posuere metus vitae ipsum aliquam non"
636,"in hac habitasse platea dictumst aliquam augue quam sollicitudin vitae consectetuer eget rutrum at lorem"
637,"ligula sit amet eleifend pede libero quis orci nullam molestie nibh in lectus pellentesque at nulla suspendisse potenti cras"
638,"pede lobortis ligula sit amet eleifend pede libero quis orci nullam molestie nibh in lectus pellentesque at nulla"
639,"donec pharetra magna vestibulum aliquet ultrices erat tortor sollicitudin mi sit amet lobortis sapien sapien non mi"
640,"justo aliquam quis turpis eget elit sodales scelerisque mauris sit amet eros suspendisse accumsan tortor quis turpis sed ante vivamus"
641,"in sapien iaculis congue vivamus metus arcu adipiscing molestie hendrerit at vulputate vitae nisl aenean lectus pellentesque eget"
642,"ultrices aliquet maecenas leo odio condimentum id luctus nec molestie sed justo"
643,"amet eros suspendisse accumsan tortor quis turpis sed ante vivamus tortor duis mattis egestas"
644,"erat fermentum justo nec condimentum neque sapien placerat ante nulla justo"
645,"ac nulla sed vel enim sit amet nunc viverra dapibus nulla suscipit"
646,"convallis morbi odio odio elementum eu interdum eu tincidunt in leo maecenas pulvinar lobortis est phasellus sit amet"
647,"vulputate elementum nullam varius nulla facilisi cras non velit nec nisi"
648,"ut mauris eget massa tempor convallis nulla neque libero convallis eget eleifend luctus"
649,"cursus id turpis integer aliquet massa id lobortis convallis tortor risus dapibus augue"
650,"nullam porttitor lacus at turpis donec posuere metus vitae ipsum aliquam non"
651,"vel nulla eget eros elementum pellentesque quisque porta volutpat erat"
652,"aliquam non mauris morbi non lectus aliquam sit amet diam in magna"
653,"pellentesque at nulla suspendisse potenti cras in purus eu magna vulputate luctus cum sociis"
654,"congue risus semper porta volutpat quam pede lobortis ligula sit amet"
655,"turpis a pede posuere nonummy integer non velit donec diam neque"
656,"eget eleifend luctus ultricies eu nibh quisque id justo sit amet sapien dignissim vestibulum vestibulum ante ipsum primis"
657,"consequat morbi a ipsum integer a nibh in quis justo maecenas rhoncus"
658,"mi pede malesuada in imperdiet et commodo vulputate justo in blandit ultrices enim lorem ipsum"
659,"ac est lacinia nisi venenatis tristique fusce congue diam id ornare imperdiet"
660,"dolor quis odio consequat varius integer ac leo pellentesque ultrices mattis odio donec vitae nisi"
661,"magna bibendum imperdiet nullam orci pede venenatis non sodales sed tincidunt eu felis fusce posuere felis sed lacus"
662,"nonummy integer non velit donec diam neque vestibulum eget vulputate ut ultrices vel augue vestibulum ante ipsum primis"
663,"justo pellentesque viverra pede ac diam cras pellentesque volutpat dui maecenas tristique est"
664,"nullam porttitor lacus at turpis donec posuere metus vitae ipsum aliquam non mauris morbi non lectus aliquam sit"
665,"potenti cras in purus eu magna vulputate luctus cum sociis natoque penatibus et magnis dis parturient montes"
666,"parturient montes nascetur ridiculus mus etiam vel augue vestibulum rutrum rutrum neque aenean auctor gravida"
667,"blandit ultrices enim lorem ipsum dolor sit amet consectetuer adipiscing elit proin interdum mauris non ligula pellentesque ultrices phasellus"
668,"ligula pellentesque ultrices phasellus id sapien in sapien iaculis congue vivamus metus arcu adipiscing"
669,"convallis duis consequat dui nec nisi volutpat eleifend donec ut dolor morbi vel lectus"
670,"suspendisse potenti nullam porttitor lacus at turpis donec posuere metus vitae ipsum aliquam non"
671,"augue luctus tincidunt nulla mollis molestie lorem quisque ut erat curabitur gravida nisi at nibh"
672,"nulla suspendisse potenti cras in purus eu magna vulputate luctus cum"
673,"ridiculus mus vivamus vestibulum sagittis sapien cum sociis natoque penatibus et magnis dis parturient montes nascetur"
674,"dolor sit amet consectetuer adipiscing elit proin risus praesent lectus"
675,"integer ac neque duis bibendum morbi non quam nec dui luctus rutrum nulla tellus in sagittis dui vel nisl duis"
676,"montes nascetur ridiculus mus vivamus vestibulum sagittis sapien cum sociis natoque penatibus et magnis"
677,"orci eget orci vehicula condimentum curabitur in libero ut massa volutpat"
678,"eget eros elementum pellentesque quisque porta volutpat erat quisque erat eros"
679,"ultrices posuere cubilia curae mauris viverra diam vitae quam suspendisse potenti nullam porttitor lacus at turpis donec posuere metus vitae"
680,"penatibus et magnis dis parturient montes nascetur ridiculus mus etiam vel augue vestibulum rutrum rutrum neque aenean auctor gravida sem"
681,"condimentum neque sapien placerat ante nulla justo aliquam quis turpis eget"
682,"nibh in lectus pellentesque at nulla suspendisse potenti cras in purus eu"
683,"ante nulla justo aliquam quis turpis eget elit sodales scelerisque mauris sit amet eros suspendisse accumsan"
684,"quam a odio in hac habitasse platea dictumst maecenas ut massa quis augue luctus tincidunt"
685,"ultrices enim lorem ipsum dolor sit amet consectetuer adipiscing elit proin interdum mauris"
686,"justo sollicitudin ut suscipit a feugiat et eros vestibulum ac"
687,"massa id nisl venenatis lacinia aenean sit amet justo morbi ut odio cras mi pede malesuada in imperdiet et"
688,"ornare imperdiet sapien urna pretium nisl ut volutpat sapien arcu sed augue aliquam"
689,"montes nascetur ridiculus mus vivamus vestibulum sagittis sapien cum sociis natoque penatibus et magnis dis parturient montes nascetur ridiculus mus"
690,"nulla ac enim in tempor turpis nec euismod scelerisque quam turpis adipiscing lorem vitae mattis nibh"
691,"metus aenean fermentum donec ut mauris eget massa tempor convallis nulla neque libero convallis eget eleifend luctus"
692,"felis sed interdum venenatis turpis enim blandit mi in porttitor pede justo eu"
693,"nibh in lectus pellentesque at nulla suspendisse potenti cras in purus eu magna vulputate"
694,"mauris enim leo rhoncus sed vestibulum sit amet cursus id turpis integer aliquet massa id lobortis convallis"
695,"imperdiet nullam orci pede venenatis non sodales sed tincidunt eu felis fusce"
696,"nunc donec quis orci eget orci vehicula condimentum curabitur in libero ut massa volutpat convallis morbi"
697,"nam ultrices libero non mattis pulvinar nulla pede ullamcorper augue a suscipit nulla"
698,"mauris laoreet ut rhoncus aliquet pulvinar sed nisl nunc rhoncus dui vel sem sed"
699,"diam id ornare imperdiet sapien urna pretium nisl ut volutpat sapien arcu sed augue aliquam erat volutpat"
700,"velit donec diam neque vestibulum eget vulputate ut ultrices vel augue vestibulum ante ipsum primis in faucibus orci"
701,"faucibus orci luctus et ultrices posuere cubilia curae nulla dapibus dolor"
702,"adipiscing lorem vitae mattis nibh ligula nec sem duis aliquam"
703,"sapien cum sociis natoque penatibus et magnis dis parturient montes nascetur ridiculus mus etiam vel augue vestibulum"
704,"commodo placerat praesent blandit nam nulla integer pede justo lacinia eget tincidunt"
705,"eleifend pede libero quis orci nullam molestie nibh in lectus pellentesque at"
706,"sit amet justo morbi ut odio cras mi pede malesuada"
707,"odio porttitor id consequat in consequat ut nulla sed accumsan felis ut at dolor quis odio consequat varius"
708,"justo nec condimentum neque sapien placerat ante nulla justo aliquam quis turpis eget elit sodales scelerisque mauris"
709,"semper rutrum nulla nunc purus phasellus in felis donec semper sapien a libero"
710,"vitae nisl aenean lectus pellentesque eget nunc donec quis orci eget orci vehicula condimentum"
711,"duis mattis egestas metus aenean fermentum donec ut mauris eget"
712,"risus auctor sed tristique in tempus sit amet sem fusce consequat"
713,"etiam justo etiam pretium iaculis justo in hac habitasse platea dictumst etiam"
714,"nunc vestibulum ante ipsum primis in faucibus orci luctus et ultrices"
715,"est lacinia nisi venenatis tristique fusce congue diam id ornare imperdiet sapien urna pretium"
716,"praesent blandit nam nulla integer pede justo lacinia eget tincidunt eget tempus vel pede morbi porttitor lorem id ligula suspendisse"
717,"semper porta volutpat quam pede lobortis ligula sit amet eleifend pede libero"
718,"consectetuer eget rutrum at lorem integer tincidunt ante vel ipsum praesent blandit lacinia erat vestibulum"
719,"diam vitae quam suspendisse potenti nullam porttitor lacus at turpis donec posuere metus vitae ipsum aliquam non mauris morbi"
720,"curae nulla dapibus dolor vel est donec odio justo sollicitudin ut suscipit"
721,"amet turpis elementum ligula vehicula consequat morbi a ipsum integer a nibh in quis justo maecenas rhoncus aliquam"
722,"turpis eget elit sodales scelerisque mauris sit amet eros suspendisse accumsan tortor quis turpis sed ante vivamus tortor duis"
723,"justo in hac habitasse platea dictumst etiam faucibus cursus urna"
724,"imperdiet et commodo vulputate justo in blandit ultrices enim lorem ipsum dolor sit amet consectetuer adipiscing"
725,"eu nibh quisque id justo sit amet sapien dignissim vestibulum vestibulum ante ipsum primis in faucibus orci"
726,"dolor vel est donec odio justo sollicitudin ut suscipit a feugiat et eros vestibulum"
727,"dapibus augue vel accumsan tellus nisi eu orci mauris lacinia sapien quis libero nullam"
728,"erat fermentum justo nec condimentum neque sapien placerat ante nulla justo aliquam quis turpis eget elit sodales scelerisque mauris"
729,"dignissim vestibulum vestibulum ante ipsum primis in faucibus orci luctus et ultrices posuere cubilia curae nulla dapibus dolor vel"
730,"nunc rhoncus dui vel sem sed sagittis nam congue risus semper porta volutpat quam pede lobortis ligula"
731,"fermentum donec ut mauris eget massa tempor convallis nulla neque libero"
732,"est et tempus semper est quam pharetra magna ac consequat metus sapien ut nunc vestibulum ante ipsum"
733,"sed vel enim sit amet nunc viverra dapibus nulla suscipit ligula in lacus curabitur at ipsum ac"
734,"sagittis sapien cum sociis natoque penatibus et magnis dis parturient montes nascetur ridiculus mus etiam vel augue vestibulum"
735,"eget tincidunt eget tempus vel pede morbi porttitor lorem id ligula suspendisse ornare"
736,"lectus in est risus auctor sed tristique in tempus sit amet sem fusce consequat nulla nisl nunc nisl"
737,"molestie lorem quisque ut erat curabitur gravida nisi at nibh in hac"
738,"lorem ipsum dolor sit amet consectetuer adipiscing elit proin interdum mauris non ligula pellentesque ultrices"
739,"velit nec nisi vulputate nonummy maecenas tincidunt lacus at velit vivamus vel nulla eget eros elementum pellentesque quisque"
740,"cum sociis natoque penatibus et magnis dis parturient montes nascetur ridiculus mus vivamus"
741,"vehicula consequat morbi a ipsum integer a nibh in quis justo maecenas rhoncus aliquam lacus morbi"
742,"sem praesent id massa id nisl venenatis lacinia aenean sit amet justo morbi ut odio cras mi pede"
743,"amet justo morbi ut odio cras mi pede malesuada in imperdiet et commodo vulputate justo in blandit ultrices enim lorem"
744,"dapibus nulla suscipit ligula in lacus curabitur at ipsum ac"
745,"dapibus duis at velit eu est congue elementum in hac habitasse platea"
746,"in hac habitasse platea dictumst etiam faucibus cursus urna ut tellus nulla ut erat id mauris vulputate elementum nullam varius"
747,"ut tellus nulla ut erat id mauris vulputate elementum nullam varius nulla facilisi cras non velit nec nisi vulputate nonummy"
748,"parturient montes nascetur ridiculus mus vivamus vestibulum sagittis sapien cum sociis natoque penatibus"
749,"posuere cubilia curae donec pharetra magna vestibulum aliquet ultrices erat tortor sollicitudin mi sit"
750,"ultricies eu nibh quisque id justo sit amet sapien dignissim vestibulum vestibulum ante ipsum primis in"
751,"cras in purus eu magna vulputate luctus cum sociis natoque"
752,"adipiscing molestie hendrerit at vulputate vitae nisl aenean lectus pellentesque eget"
753,"convallis tortor risus dapibus augue vel accumsan tellus nisi eu orci"
754,"nec euismod scelerisque quam turpis adipiscing lorem vitae mattis nibh ligula nec sem duis aliquam convallis nunc proin at turpis"
755,"consectetuer adipiscing elit proin risus praesent lectus vestibulum quam sapien varius ut blandit non interdum in"
